question,document,answer_score,answer_reasoning,trajectory_score,trajectory_reasoning
"If homework isn't mandatory, what do I need to pass to get certified?",9f689c185f,good,"The agent's answer matches the ground truth. It correctly states that passing the Capstone project is required for certification and that homework is not mandatory, while also noting homework is recommended and contributes to leaderboard points.",good,"The tool call was relevant and used appropriate keywords from the question, focusing on homework, certification, and passing requirements. Only one search was needed, which is reasonable and efficient."
Does missing homework stop me from earning the certificate in this course?,9f689c185f,good,"The agent’s answer matches the ground truth. It correctly states that homework is not mandatory, that passing the Capstone project is required for the certificate, and that homework points only affect leaderboard rank. This preserves the key meaning of the original answer.",good,"The single search query is relevant to the question and includes core keywords like homework and certificate. One search was sufficient, with no unnecessary duplicate calls, and it supported the final answer."
Why does the homework content keep changing before it’s released?,96286b4be4,good,"The agent’s answer matches the ground truth closely. It correctly explains that `[DRAFT]` means the homework is not ready, that readiness requires both the form to be open and the title not to contain `[DRAFT]`, and that content may still change before release. The wording about working on it early being allowed is slightly different from the original’s ‘at your own risk,’ but it preserves the same meaning.",good,"The single search query is relevant to the question and uses key terms about homework content changing before release. Only one tool call was made, which is reasonable, and there were no unnecessary duplicate searches. The tool call supports the final answer."
What does it mean when a homework title has [DRAFT] in it?,96286b4be4,good,"The agent’s answer matches the ground truth closely. It correctly says that `[DRAFT]` means the homework is not ready yet, and it includes the two conditions for readiness: the homework form must be open and the title must not contain `[DRAFT]`. It also captures the warning that the content may still change and that working on it early is at the user’s own risk. This is consistent with the original answer.",good,"The single search query was relevant and contained the key keyword `[DRAFT]` along with the homework context. One search was sufficient, and there were no unnecessary or duplicate tool calls. The tool use reasonably supported the final answer."
How can I tell if a homework assignment is actually ready?,96286b4be4,good,"The agent’s answer matches the ground truth. It correctly states that a homework assignment is ready only when the homework form is open and the title does not contain [DRAFT]. It also includes the warning that if [DRAFT] is present, the assignment is not ready and the content may still change, which aligns with the original answer. No important information is missing or contradicted.",good,"The single search query was relevant to the question and included key terms like homework, assignment, and ready. One search was sufficient, and there were no redundant or unnecessary tool calls. The tool call reasonably supported the final answer."
Can I start working on a homework before the final version is out?,96286b4be4,good,"The agent’s answer matches the ground truth. It correctly says you can work on it only at your own risk, and it includes the two readiness conditions: the form must be open and the title must not contain [DRAFT]. It also notes that draft content can change before the final version is released. This preserves the key information from the original answer.",good,"The single search query was relevant to the question and included key concepts like homework, draft, and final version. One tool call is reasonable here, and there were no unnecessary duplicates or obvious inefficiencies. The tool use supported the final answer adequately."
Why is the homework on the platform still different from what I saw earlier?,96286b4be4,good,"The agent answer matches the ground truth well. It correctly states that if the homework title contains [DRAFT], the homework is not ready yet, and that readiness requires both the form being open on the course platform and the title not containing [DRAFT]. It also captures the idea that the content can still change and that earlier versions may differ. The extra sentence about GitHub homework instructions is not in the ground truth, but it does not contradict the main answer.",good,"The search query was relevant to the user’s question and included the general idea of homework being different or updated. Only one search call was made, which is reasonable for this kind of FAQ lookup. The query was somewhat broad, but still appropriate, and there were no unnecessary duplicate searches."
When is llm-zoomcamp going to be offered again?,bd31146b0e,good,The agent answer matches the ground truth: it states that LLM Zoomcamp will be offered again in summer 2027. This contains the key information and is accurate.,good,"The single search query is relevant and includes the key terms from the question (llm-zoomcamp, offered again, next cohort schedule). One search call is sufficient for this simple factual question, and there are no unnecessary duplicate calls."
Do we know the next start date for this course?,bd31146b0e,good,The agent answer matches the ground truth exactly in meaning: it states the next start date is Summer 2027. This contains the key information and correctly answers the question.,good,"The single search query is relevant to the question and directly targets the next start date of the course. One search call is reasonable and sufficient here, and it supports the final answer well."
Is there a planned offering of the course in Summer 2027?,bd31146b0e,good,The agent answer matches the ground truth exactly in meaning: it states that the next planned offering is Summer 2027. This is the key information requested by the question.,good,"The search query was relevant and contained the key terms from the question ('planned offering', 'summer 2027', 'course'). Only one search was needed, and it reasonably supported the final answer."
When should I expect the next run of llm-zoomcamp?,bd31146b0e,bad,"The agent did not match the ground truth. The correct answer is 'Summer 2027,' but the agent said it could not find a specific date and then gave unrelated course availability and a current cohort link. That omits the key information required by the FAQ answer and is therefore incorrect.",good,"The search query was relevant to the question and used key terms like 'llm-zoomcamp' and 'next run.' Only one search was made, which is reasonable. However, the search did not lead to the correct FAQ answer, and the final response did not reflect the ground truth."
What’s the next time this course will be available?,bd31146b0e,good,The agent’s answer matches the ground truth exactly in meaning and content: it states that the next availability is Summer 2027. No missing or conflicting information.,good,"The single search query is relevant to the question and asks about the next available offering. While it did not include the exact course name, the question itself is generic and the query is reasonable. Only one search call was needed."
Where should I start if I want to find the course videos and lesson materials?,31456f4b5f,good,"The agent’s answer matches the ground truth well. It correctly identifies the LLM Zoomcamp GitHub repository as the main entry point and says to open the lesson folders where relevant videos are linked at the top. It also mentions lesson materials/notebooks, which is consistent with the original answer. The extra workflow steps are not in the ground truth but do not contradict it.",good,"The search query was broadly relevant to the question and contained some of the important concepts (course videos, lesson materials, start). Only one search call was made, which is reasonable for this simple lookup. The query was a bit generic, but it still supported the final answer."
"Do I need to check YouTube for the lectures, or is there a better place to look first?",31456f4b5f,good,"The agent’s answer matches the ground truth. It correctly says to check the GitHub repo first, identifies the LLM Zoomcamp GitHub repository as the main entry point, mentions that lesson folders contain the relevant video links, and notes that the repo is easier to keep updated than the YouTube playlist. This preserves the key information from the original answer.",good,"The tool call was reasonable and relevant. The search query targeted the core question about lectures and whether YouTube is the first place to look, which is appropriate for retrieving the FAQ answer. Only one search was used, which is sufficient here and not excessive."
How do I find the videos for each lesson in the LLM Zoomcamp course?,31456f4b5f,good,"The agent’s answer matches the ground truth well. It correctly says to use the LLM Zoomcamp GitHub repository as the main entry point, open the lesson folders, and look for the videos linked at the top of each lesson page. It also includes the recommendation to prefer the GitHub repo over the YouTube playlist because it is easier to keep updated. This contains the key information from the original answer.",good,"The single search query was relevant to the user’s question and included the important topic keywords (LLM Zoomcamp, videos, lesson). Only one tool call was made, which is reasonable here. The tool use supported the final answer."
Is there an official repo page that points to the lecture videos for every lesson?,31456f4b5f,good,"The agent answer matches the ground truth: it identifies the LLM Zoomcamp GitHub repository as the main entry point, says each lesson page/folder has the relevant videos linked at the top, and notes that the repo is preferred over the YouTube playlist because it is easier to keep updated. This contains the key information from the original answer.",good,"The single search query is relevant to the question and captures the core idea of an official repository page for lecture videos. One search call is sufficient here, and there were no unnecessary duplicate or excessive tool calls."
"If the YouTube playlist is out of date, where should I go to get the most current lesson links?",31456f4b5f,good,"The agent’s answer matches the ground truth. It correctly says to use the LLM Zoomcamp GitHub repository as the main entry point, notes that lesson folders contain the relevant video links at the top, and states that the repo is the most up-to-date source when the YouTube playlist is outdated.",good,"The search query was relevant to the question and targeted the key idea of an out-of-date YouTube playlist and current lesson links. Only one search was needed, and the tool usage was reasonable and sufficient for producing the final answer."
