question,document,answer_score,answer_reasoning,trajectory_score,trajectory_reasoning
"I just found this course late — can I still join, or is it too late to start?",74eb249bbf,good,"The agent answer matches the ground truth. It says the student can still join/start anytime and includes the key condition that to receive a certificate, the project must be submitted while submissions are still being accepted.",good,"The search query was relevant to the question and contained the important keywords about joining late and starting too late. Only one search call was used, which is reasonable for this straightforward FAQ-style question, and it supported the final answer."
Am I allowed to enroll if I only discovered the course now?,74eb249bbf,good,"The agent’s answer matches the ground truth. It correctly says the user can still join if they discovered the course now, and it includes the key condition that to receive a certificate they must submit the project while submissions are still open. This is the same substantive information as the original answer, just phrased slightly differently.",good,"The search query was relevant to the user’s question about late enrollment and included appropriate keywords like enrolling, discovered course, and now. Only one search call was made, which is reasonable for this simple FAQ-style question. The tool use supported the final answer."
"If I join after the course has started, can I still get a certificate?",74eb249bbf,good,"The agent’s answer matches the ground truth on the key point: yes, you can still get a certificate if you join after the course has started, provided you submit your project while submissions are still being accepted. The extra statement about needing to finish with the live cohort is not in the original answer, and the claim that certificates are not available for self-paced completion is unsupported by the ground truth, but the main answer is correct.",good,"The search query was relevant and contained the core keywords from the question ('join after course started' and 'certificate'). Only one search was needed, and it reasonably supported the final answer. There was no unnecessary repetition."
What do I need to do to qualify for the certificate if I’m joining late?,74eb249bbf,good,"The agent’s answer matches the ground truth on the core requirement: if joining late, you can still qualify for the certificate as long as the project is submitted while submissions are still open. It adds extra details about homework and passing the capstone, which are not in the original answer but do not contradict it. The key information is preserved, so the answer is effectively correct.",good,"The search query is relevant to the question and includes important concepts like certificate and late joining. Only one search was made, which is reasonable for this simple FAQ-style question. The tool call supports the final answer."
"Is it okay to start the course now, and what’s the deadline for the final project if I want the certificate?",74eb249bbf,good,"The agent’s answer is mostly aligned with the ground truth on the main point: you can start now, and to get a certificate you must submit the project while submissions are still open. However, it adds extra claims not supported by the original answer, such as needing to complete the course with the live cohort and that self-paced mode does not qualify for a certificate. It also says the FAQ doesn’t give a specific date, which is consistent, but the extra unsupported details make it not an exact match. Still, the core answer is correct.",good,"The search queries were relevant to the user’s question and included key terms like starting the course, deadline, final project, and certificate. Two searches is a reasonable number, though the second is somewhat repetitive rather than clearly refining the first. Overall the tool use was acceptable and supported the final answer."
"I signed up for the LLM Zoomcamp — when should I get the confirmation email, or am I missing something?",977bf7786c,good,"The agent answer matches the ground truth closely. It correctly says no confirmation email is needed, the user is already accepted, registration is only to gauge interest, it is not checked against a registered list, and homework can be submitted while the form is open even without registering. The extra offer to point to resources is harmless.",good,"The search query was relevant and included key terms from the question such as 'LLM Zoomcamp' and 'confirmation email'. Only one search was needed, which is reasonable, and it directly supported the final answer."
Do I actually need a registration confirmation to join the course and submit homework?,977bf7786c,good,"The agent answer matches the ground truth. It correctly states that a registration confirmation is not needed, that the student is accepted, can start learning and submit homework while the form is open without registering, and that registration is not checked against any list. It also notes registration is just for gauging interest, which aligns with the original answer.",good,"The single search query was relevant to the question and contained key terms like registration, join course, and submit homework. One search call was reasonable and sufficient; there were no unnecessary duplicate calls."
"If I never got an email after registering, can I still start the LLM Zoomcamp anyway?",977bf7786c,good,"The agent answer matches the ground truth. It correctly says the email is not needed, that the user is accepted, that they can start learning and submitting homework while the form is open even without registering, and that registration is only to gauge interest. This preserves the key FAQ points.",good,"The single search query is relevant and includes the core keywords from the question: never got an email, registering, start LLM Zoomcamp anyway. One search is sufficient here, and there were no unnecessary or duplicate tool calls."
"Is there a real acceptance step for the course, or does registration just help you track interest?",977bf7786c,good,"The agent answer matches the ground truth closely. It says there is no real acceptance step, that the student is considered accepted, that they can start learning and submitting homework while the form is open, and that registration is only to gauge interest before the start date and not used as an approved list. This contains the key information from the original answer.",good,"The tool call was relevant and used important keywords from the question, such as acceptance, registration, and track interest. Only one search was needed, and there were no unnecessary duplicate calls. The search supported the final answer well."
"Do I need to be on some registered list before I can do the homework, or is that not required?",977bf7786c,good,"The agent’s answer matches the ground truth closely. It correctly says no registered list is needed, homework can be started and submitted while the form is open, it is not checked against a registered list, and registration is only to gauge interest before the start date. This preserves the key information from the original answer.",good,"The single search query was relevant to the question and included important keywords like 'registered list' and 'homework'. Only one search call was made, which is reasonable for this straightforward question, and it supported the final answer."
How do students join the Office Hours or live workshop stream if the Zoom link is private?,489dd1c9d9,good,"The agent answer matches the ground truth. It correctly states that the Zoom link is only for instructors/presenters/TAs, and that students should join via YouTube Live, ask questions through Slido, check the announcements channel on Telegram and Slack, and can also watch on the DataTalksClub YouTube channel. It also includes the warning not to use Zoom chat for questions, which is consistent with the original answer.",good,"The search query was relevant to the question and included key terms like students, Office Hours/live workshop stream, and Zoom link private. Only one search call was needed, which is reasonable because the final answer directly aligned with the expected FAQ response. There were no unnecessary or duplicate tool calls."
Where can I find the live video link for office hours before the session starts?,489dd1c9d9,good,"The agent’s answer matches the ground truth. It correctly says the video link is posted in the announcements channel on Telegram and Slack before the session starts, and that it can also be watched on the DataTalksClub YouTube Channel. It also correctly mentions that the Zoom link is only for instructors/presenters/TAs and that students use YouTube Live and Slido. This contains the key information from the original answer, even though it omits the detail about not posting questions in chat.",good,"The single search query is relevant and closely matches the question’s wording. Only one search call was needed, and there were no redundant or unnecessary tool calls. The tool use reasonably supported the final answer."
"If I can’t use Zoom, what should I use to watch the workshop and ask questions?",489dd1c9d9,good,"The agent’s answer matches the ground truth well. It correctly states that students should watch via YouTube Live and ask questions through Slido, mentions that the Zoom link is only for instructors/presenters/TAs, notes the announcements channel on Telegram/Slack for the video link, and warns not to rely on chat for questions. This covers the key information from the original answer.",good,"The single search query is relevant to the user’s question about alternatives to Zoom for watching the workshop and asking questions. Although the query is a bit generic, it is reasonable for one lookup and there were no unnecessary duplicate calls. The tool use supports the final answer."
"Why aren’t students given the Zoom URL for office hours, and where should questions go instead?",489dd1c9d9,good,"The agent’s answer matches the ground truth on the key points: the Zoom link is only for instructors/presenters/TAs, students use YouTube Live, questions go to Slido, and questions should not be posted in chat because they may be missed. It omits the specific YouTube Channel mention, but that is not essential to the question asked. Overall, the answer is correct.",good,"The single search query was relevant and included the main concepts from the question (Zoom URL, office hours, students, and where questions should go). One search was sufficient, and there were no unnecessary duplicate calls. The tool use reasonably supported the final answer."
"Is the live session posted anywhere like Telegram, Slack, or YouTube before it begins?",489dd1c9d9,good,"The agent answer matches the key points in the ground truth: the video link is posted in the announcements channel on Telegram and Slack before the session begins, and the session can also be watched live on the DataTalksClub YouTube channel. It omits a few extra details from the original answer (that the zoom link is only for instructors/presenters/TAs, and that questions should be submitted via Slido rather than chat), but those omissions do not prevent the answer from correctly addressing the question.",good,"The single search query was relevant and included the important concepts from the question: live session, Telegram, Slack, YouTube, and before it begins. One search was sufficient, and there were no unnecessary or duplicate tool calls."
What’s the best way to begin the course if I’m new here and don’t want to miss anything?,04919992b3,bad,"The agent answer does not match the ground truth well. The original answer says to start with the LLM Zoomcamp docs, general Zoomcamp logistics docs, and GitHub repo, and then follow a typical workflow: watch videos, work through notebooks/code, read homework instructions on GitHub, and submit via the course platform before deadlines. The agent instead gives generic advice about reading the repo, setting up an environment, working through modules, committing work, and not needing OpenAI specifically. It misses the key documents, the course platform/deadlines, and the specific workflow. So the answer is incomplete and partly unrelated.",bad,"The single search query was very generic and did not include the course name or key terms like LLM Zoomcamp, docs, GitHub, or homework. Since the question is about how to begin a specific course, the query was not well targeted. Only one call was made, which is reasonable in number, but it did not support the final answer well and was not refined."
"Do I need to wait for a start date, or can I just jump into the LLM Zoomcamp materials whenever I want?",04919992b3,good,"The agent’s answer matches the ground truth on the key point: you can start anytime and do not need to wait for a start date. It also correctly mentions that videos and GitHub materials are available, and it gives the same basic workflow for watching videos, working through code, reading homework instructions, and submitting before the deadline. It is slightly less complete because it omits the specific docs/repository links and the note that homework is similar but may use a different dataset or slightly different task. However, the core answer is correct.",good,"The search query was relevant to the user’s question and included the key idea of starting anytime with LLM Zoomcamp materials. Only one search call was made, which is reasonable for a straightforward FAQ-style question. The tool call appears to have supported the final answer adequately."
"What’s the usual weekly routine for this course — video first, then notebooks, then homework?",04919992b3,good,"The agent’s answer matches the ground truth on the core point: the workflow is video first, then notebooks/code, then homework, with submission before the deadline. It also correctly confirms the student’s understanding. It omits the extra context about starting anytime, the docs/repository links, and that homework may use a different dataset or slightly different task, but those omissions do not change the main answer to the question.",good,"The single search query was relevant to the question and included the key concepts of video, notebooks, and homework order. One search was reasonable for this simple factual question, and there were no unnecessary duplicate calls. The tool call supported the final answer."
Where are the deadlines and homework instructions posted for the course?,04919992b3,good,"The agent’s answer matches the key point in the ground truth: deadlines are listed on the LLM Zoomcamp course management platform, and homework instructions are on GitHub. It omits some extra context from the original answer, but the essential information is present and correct.",good,"The search query was relevant and included the main concepts from the question (deadlines, homework instructions, course). Only one search was needed, and the resulting answer was supported by that call."
"Is the homework basically the same as the lesson exercises, or does it use different data/tasks?",04919992b3,good,"The agent answer matches the ground truth on the core point: homework is similar to the lesson exercises but typically uses different data or slightly different tasks. It also correctly conveys that it is not the exact same exercises/data. The extra note about checking GitHub homework instructions and the course platform is not contradictory to the original answer, though it is not part of the direct answer to the question.",good,"The single search query is relevant and contains key concepts from the question (homework, lesson exercises, same data/tasks, different data). One search is reasonable here, and there were no unnecessary duplicate calls. The tool call supports the final answer adequately."
How do I find myself on the leaderboard if I can’t see my name there?,c2903069a0,good,"The agent’s answer matches the ground truth. It correctly says the user may have been assigned a random display name and instructs them to use the “Jump to your record on the leaderboard” link. It also mentions “Edit Course Profile” and accurately explains the two fields: public display name and official name for the certificate. This preserves the key information from the original answer, even though it is paraphrased.",good,"The single search query is relevant and contains the core issue: not seeing one’s name on the leaderboard and finding oneself. One search was sufficient here, and there were no unnecessary duplicate calls. The tool use reasonably supported the final answer."
Why does the leaderboard show some random name instead of my real one?,c2903069a0,good,"The agent’s answer matches the ground truth well. It correctly explains that the leaderboard shows a random default display name, gives an example like “Lucid Elbakyan,” and tells the user to edit the course profile. It also correctly distinguishes between the public/display name and the official certificate name. The only slight mismatch is that the ground truth specifically mentions clicking the ""Jump to your record on the leaderboard"" link to locate the entry and explicitly notes that the second field is mandatory if you do not want the random name on the certificate, but these omissions do not materially affect correctness.",good,"The search query was relevant and contained key terms from the question such as leaderboard, random name, real name, and display name. Only one search was used, which is reasonable because the question is straightforward and the resulting answer was accurate. No unnecessary duplicate calls were made."
Where can I check what display name I’m using for the course?,c2903069a0,good,"The agent answer matches the core instruction from the ground truth: click “Edit Course Profile” to check the display name. It also correctly explains the first and second fields. It omits some extra details about the random default name and the leaderboard link, but those are not essential to the question asked.",good,"The single search query was relevant and included the key phrase 'display name' and 'course'. One search was sufficient, and there were no unnecessary duplicate calls."
Can I change the name that appears on the leaderboard and in the course profile?,c2903069a0,good,"The agent’s answer matches the ground truth. It correctly says that in Edit Course Profile, the first field is the display name/nickname shown on the leaderboard, and the second field is the official name used for the certificate and course profile. This preserves the key distinction and directly answers the user’s question about changing the name on the leaderboard and in the course profile.",good,"The single search query was relevant to the question and contained important keywords like change name, leaderboard, and course profile. Only one search was needed, and it supported the final answer without unnecessary extra calls."
How do I make sure the name on my certificate is my official name and not the default one?,c2903069a0,good,"The agent’s answer matches the ground truth. It correctly says to use Edit Course Profile and change the second field to the official name from an ID/passport, and that this is the name printed on the certificate. It also correctly distinguishes the first field as the public/display name. This contains the key information from the original answer, though it omits the note about the automatically assigned default name and the leaderboard link, which are not essential to the core question.",good,"The search query was relevant and included important keywords like certificate, official name, and default name. Only one search call was made, which is reasonable for this simple question. The tool use supports the final answer and does not include unnecessary duplicate searches."
Can I do the course on my own schedule and still get the certificate?,69d122f12e,good,"The agent answer matches the ground truth. It correctly states that a certificate is only available if the course is completed with a live cohort, and that self-paced learners do not receive certificates because they must peer-review 3 capstone projects while the course is actively running. This preserves the key details and meaning of the original answer.",good,"The single search query was relevant to the user's question and included key concepts like self-paced and certificate. One search call is reasonable here, and no unnecessary duplicate calls were made. The tool use appropriately supported the final answer."
"If I take the self-paced version, will I still receive a certificate at the end?",69d122f12e,good,The agent’s answer matches the ground truth. It correctly says that self-paced students do not receive a certificate and that certificates are only awarded for those who complete the course with a live cohort. It also includes the key reason: peer-reviewing capstone projects is only possible while the course is running.,good,"The tool call was relevant and contained key terms from the question ('self-paced version', 'certificate'). A single search was sufficient, and there were no unnecessary duplicate calls. The search supported the final answer."
Do certificates count for students who join later and study without the live cohort?,69d122f12e,good,"The agent’s answer matches the ground truth. It correctly says certificates are only awarded when finishing with the live cohort, and that self-paced/later-joining students can still take the course but won’t receive a certificate because peer-review is required while the course is running. This preserves the key information from the original answer.",good,"The single search query was relevant and contained the main keywords from the question: certificates, students join later, live cohort, self-paced. One search is reasonable here, and there were no unnecessary or duplicate calls. The tool use appropriately supported the final answer."
Why isn’t there a certificate for self-paced learners in this course?,69d122f12e,good,"The agent’s answer matches the ground truth: it says certificates are only for live cohort completers, not self-paced learners, and explains that the requirement is peer-reviewing 3 capstones, which is only possible while the course is running. This contains the key information from the original answer.",good,"The search query was directly relevant to the question and included key terms like certificate and self-paced learners. Only one search was used, which is reasonable since it was sufficient to support the final answer. No unnecessary or duplicate tool calls were made."
Is the certificate only available when the course is running live and peer review is open?,69d122f12e,good,"The agent’s answer matches the key information from the ground truth: certificates are only available for the live cohort, not self-paced mode, and the reason is that learners must peer-review 3 capstone projects while the course is running. Although it begins with a brief 'Yes' instead of 'No,' the rest of the answer correctly explains the condition in a way that aligns with the original FAQ answer. Overall, the substantive content is correct.",good,"The tool call was relevant and used appropriate keywords from the question ('certificate', 'live', 'peer review open'). Only one search was needed, and there were no unnecessary or duplicate calls. The search supports the final answer reasonably well."
Can I still get the course certificate if I skipped the first homework?,9f689c185f,good,"The agent answer matches the ground truth. It correctly states that skipping the first homework does not prevent getting the certificate, that passing the Capstone project is required, and that homework is optional but recommended and affects leaderboard rank. This preserves the key information from the original answer.",good,"The search query was relevant to the question and included key concepts like certificate and homework requirement. Only one search call was made, which is reasonable since the answer was straightforward and the query was sufficiently targeted. The tool call supported the final answer."
"Is the first homework required for the certificate, or is the final project enough?",9f689c185f,good,"The agent answer matches the ground truth. It correctly states that the first homework is not required, that passing the Capstone/final project is sufficient for the certificate, and that homework is optional but recommended and contributes to leaderboard rank.",good,"The single search query was relevant and contained the key concepts from the question: certificate, homework, and final project. One search was sufficient, with no unnecessary duplicate calls."
Do I need to complete all homework assignments to receive the certificate?,9f689c185f,good,"The agent's answer matches the ground truth. It correctly says homework is not mandatory for the certificate, and that passing the Capstone project is required. It also includes the extra detail that homework is recommended and counts toward leaderboard points, which is consistent with the original answer.",good,"The search query was relevant and included key concepts from the question such as certificate and homework assignments. Only one search was used, which is reasonable for this simple FAQ-style question, and the tool call supported the final answer."
