question,document,score,reasoning
Do I need to install anything before using a .env file for API keys in this course?,233dabe430,good,"The AI answer correctly says to install python-dotenv if using a .env file in Python and shows loading it with load_dotenv(). However, it adds an incorrect/irrelevant note about `dirdotenv`/`direnv` alternatives, which are not part of the ground truth, and it omits the course recommendation to store keys in .env and add `.env` to `.gitignore`. Still, the key question asks whether anything needs installing, and the answer addresses that accurately."
Should .env be added to gitignore when storing secret keys?,233dabe430,good,"The AI answer correctly states that .env should be added to .gitignore to prevent committing secret keys, and includes the correct ignore pattern. It omits the additional course-specific details about using python-dotenv and loading keys in Python, but those are not necessary for answering the question asked. The mention of .env.example is extra but consistent."
How can I access keys like GEMINI_API_KEY from environment variables in my script?,233dabe430,good,"The AI answer correctly explains loading a .env file with python-dotenv and accessing GEMINI_API_KEY via os.getenv(). It also adds extra Kestra-specific information that is not in the ground truth, but the core answer matches the intended guidance."
Can I do the homework with a different LLM provider than the one suggested?,ee43413718,good,"The AI answer preserves the key point that the suggested provider is optional and lists the same alternative providers. It also correctly notes that code may need adaptation for differing response formats, tool schemas, and tokenizers. This is semantically equivalent to the ground truth, though it omits the note that the homework is designed not to require a paid service and the link to provider ideas. Those omissions do not change the core answer."
"Is the recommended model required for the assignment, or can I swap it out?",ee43413718,good,"The AI answer preserves the key point that the recommended model is not mandatory and can be swapped for other providers. It also correctly notes that code may need adaptation due to differing formats/schemas/tokenizers. This is semantically equivalent to the ground truth, though it omits the note about not needing a paid service and the link to alternatives, which are extra details not essential to the core answer."
What providers are okay to use for the homework besides the default one?,ee43413718,good,"The AI answer preserves the main idea that the default provider is not mandatory and lists several acceptable alternatives including OpenAI, Gemini, Groq/OpenAI-compatible providers, and local models. It adds Anthropic and specific tools like Ollama/LM Studio, which are extra but not contradictory. It does not miss the key point that no paid service is required and provider adaptation may be needed, but that omission is not fatal given the question asks which providers are okay to use. Overall semantically equivalent."
"Do I need a paid API to finish the RAG homework, or can I use free/local options?",ee43413718,good,"The AI answer matches the ground truth: it says a paid API is not required, mentions free/local options and several providers, and notes that code may need adaptation due to differing response formats and tool schemas. It preserves the key point and adds harmless extra examples."
"If I use another model provider, what kind of code changes should I expect?",ee43413718,good,"The AI answer matches the ground truth: it says the recommended model is not mandatory, mentions using other providers, and explains that code may need adaptation because response formats, tool schemas, and tokenizers differ. It also correctly notes that OpenAI-compatible providers may require only minimal changes. This is semantically equivalent, though it omits the explicit list of providers and the note that paid service is not needed."
How can I use Gemini in the Module 1 notebook with the OpenAI-style endpoint instead of the usual setup?,0ae5c221b9,good,"The AI answer matches the ground truth: it explains the three needed pieces (Gemini API key in .env, OpenAI client with Google’s OpenAI-compatible base URL, and the Gemini model name), provides essentially the same code using `client.chat.completions.create`, and correctly notes that this is the older chat-completions style requiring notebook adjustments for response reading and tool/function call handling. The extra mention of `chat.completions.parse` is not in the original, but it does not contradict the core answer."
What do I need to configure before calling Google Gemini through OpenAI client code in the RAG notebook?,0ae5c221b9,good,"The AI answer captures all key requirements from the ground truth: API key in .env, OpenAI client with Google's OpenAI-compatible base URL, and specifying the Gemini model name. It also correctly notes the need to use chat completions instead of the newer Responses API. This is semantically equivalent to the original answer, though it omits some implementation details like loading the key with dotenv and specific handling of messages/tools, which are not essential to the core question."
How do I write the helper function for Gemini if I want to load the key from a .env file and send chat messages?,0ae5c221b9,good,"The AI answer reproduces the key helper function correctly: it loads the Gemini API key from a .env file via python-dotenv, configures the OpenAI client with Google’s OpenAI-compatible base URL, sends developer/user messages through chat completions, and returns the assistant content. It also includes the .env variable name. The extra note about installing python-dotenv is fine and does not change the meaning. The only omission is the explanatory note about older chat completions vs newer Responses format, but that is not required to answer the question asked."
Why does the notebook code need changes when switching from Responses format to chat completions with Gemini?,0ae5c221b9,good,"The AI answer captures the key point: switching from Responses format to chat completions requires code changes because the response and tool/function-call structures differ, and it mentions reading from `choices[0].message.content` versus Responses-style fields as well as `messages` vs `input`. This is semantically aligned with the ground truth, though it is a bit more general and does not mention the API key/base URL/model setup, which are not the core of the question."
Which model name and base URL should I use if I want to run Gemini from the course notebook using the compatible API?,0ae5c221b9,good,The AI answer correctly identifies both the Gemini model name and the compatible API base URL from the ground truth. It preserves the core information needed to run Gemini in the notebook. No key details are missing for the asked question.
"How do I install Ollama on macOS, Windows, or Linux?",1d0b969028,good,"The AI answer correctly covers the installation methods for macOS, Windows, and Linux, and includes the same Linux install command. It also includes the post-install test commands `ollama run llama3` and `curl http://localhost:11434`. However, it omits the Python client installation and example, which are part of the original answer but not essential to the core installation question. Since the main installation instructions are semantically equivalent, this is acceptable."
"After installing Ollama, what command should I run to get the local model working?",1d0b969028,good,"The AI answer gives the exact command specified in the ground truth for getting the local model working after installation: `ollama run llama3`. It matches the key information and is semantically equivalent, though it omits the extra explanatory details, which are not required."
How can I check if the Ollama server is running on my machine?,1d0b969028,good,"The AI answer correctly explains how to test whether the Ollama server is running by curling localhost on port 11434 and expecting a JSON response. This matches the key point of the ground truth, though it omits the extra installation and Python details, which are not required for this question."
What do I need to install in Python to use Ollama from code?,1d0b969028,good,"The AI answer correctly identifies the required Python package to use Ollama from code: `pip install ollama`. This matches the key point of the ground truth, even though it omits the additional installation and usage steps. The question asks what to install in Python, so the answer is sufficient and semantically equivalent."
Can you show a simple Python example for sending a prompt to Ollama and printing the reply?,1d0b969028,good,"The AI answer provides a correct minimal Python example for sending a prompt to Ollama and printing the reply, matching the ground truth core content. It also includes the required setup steps. The only minor difference is that it hardcodes the prompt instead of using a variable like `your_prompt`, which does not change the semantic correctness."
"Why am I getting a connection refused error when I try to prompt my Ollama RAG setup, and how do I fix it?",c6fc2d4d11,good,"The AI answer matches the ground truth: it identifies that the Ollama server is not running, gives the same restart command, and advises rerunning the cell containing `ollama serve` after restarting the notebook cell. No key information is missing."
My homework is failing with connection refused from Ollama—do I need to restart the server somehow?,c6fc2d4d11,good,The AI answer matches the ground truth: it recommends restarting the Ollama server with the exact command and notes rerunning the notebook cell containing `ollama serve` after stopping/restarting. No key information is missing or incorrect.
What should I do if Ollama stops responding in the notebook and I get a refused connection error?,c6fc2d4d11,good,The AI answer conveys the same remedy as the ground truth: restart the Ollama server with the given command and rerun the cell containing `ollama serve` after stopping/restarting the notebook cell. This is semantically equivalent.
Is there a command to bring Ollama back up when the RAG prompt shows connection refused during the assignment?,c6fc2d4d11,good,The AI answer matches the ground truth: it gives the same command to restart the Ollama server and includes the note about rerunning the notebook cell if it was stopped and restarted. No key information is missing or incorrect.
"After restarting my notebook, Ollama seems dead and my prompts fail—what’s the proper way to relaunch it?",c6fc2d4d11,good,The AI answer matches the ground truth: it gives the same command to restart the Ollama server and notes rerunning the cell containing `ollama serve` after stopping/restarting the notebook cell. No key information is missing or incorrect.
Why does my `tiktoken` token count come out lower than what the OpenAI API says?,bf0403d21b,good,"The AI answer captures the key explanation: tiktoken counts visible text only, while the API includes internal chat-formatting overhead, including per-message structural tokens and an assistant-start token, plus possible whitespace/Unicode effects. This is semantically equivalent to the ground truth."
Is OpenAI adding extra chat-format tokens beyond the text I send?,bf0403d21b,good,"The AI answer preserves the core point: OpenAI counts extra internal chat-format tokens beyond the visible text, including 4 per message, 2 global tokens, and possible slight increases from whitespace/Unicode. This is semantically equivalent to the ground truth, though it omits the specific example numbers, which are not essential."
How many hidden tokens does a `chat.completions.create()` message usually add?,bf0403d21b,good,"The AI answer states the key point from the ground truth: each chat.completions.create() message usually adds 4 hidden structural tokens. It omits the additional 2 global tokens and other nuances, but those are extra details rather than the core answer to the question asked."
Why do I see a few more tokens in the API response than in my local count?,bf0403d21b,good,"The AI answer preserves the key explanation: API counts additional internal chat-formatting tokens beyond a local `tiktoken.encode()` count, including per-message structural tokens, a couple of global tokens, and possible extra whitespace/Unicode effects. This is semantically equivalent to the ground truth, even though it is less specific about the exact token numbers and per-message token count."
"Can newlines, spaces, or weird Unicode characters change the token count?",bf0403d21b,good,"The AI answer captures the key point that newlines, spaces, and uncommon Unicode characters can affect token count. Although it omits the broader context about chat-formatting overhead and the specific token discrepancy example, it still answers the question correctly and semantically matches the relevant part of the ground truth."
How can I keep my API key set for a project without typing export every time I open a new terminal?,8b2f5e9d04,good,"The AI answer conveys the same core recommendation: use dirdotenv, install it, add the shell hook, place the API key in a .env file, ignore it in git, and optionally use direnv. It preserves the key idea that the variable loads automatically when entering the project directory. It omits some extra details from the ground truth (portable across shells/OS, GitHub Codespaces secrets, python-dotenv), but those are optional additions rather than required to answer the question."
What’s the easiest way to auto-load my OpenAI key when I cd into the right folder?,8b2f5e9d04,bad,"The AI answer only partially matches the ground truth. It correctly mentions `.env` and `python-dotenv` for loading environment variables in Python, but the question asks for the easiest way to auto-load the OpenAI key when changing directories. The original answer’s main solution is `dirdotenv` (or `direnv`) with a shell hook that automatically loads `.env` on `cd`. The AI answer explicitly says it doesn't know about an automatic `cd` hook and fails to provide the key recommended tool or setup. This misses the core point."
"Can I use something like direnv for .env files, and is there a tool that works across shells and OSes?",8b2f5e9d04,good,"The AI answer correctly identifies dirdotenv as the tool that works like direnv, supports both .env and .envrc, and is more portable across shells and operating systems. It also includes the setup example and notes that direnv is fine if already used. It omits some extra details from the ground truth (GitHub Codespaces secrets and python-dotenv), but those are ancillary and not required for the core question."
What should I put in my setup so secret keys don’t get committed to GitHub by accident?,8b2f5e9d04,good,"The AI answer captures the core actionable advice: use a `.env` file and add it to `.gitignore` to prevent committing secrets. This matches the main point of the ground truth. However, it omits the specific recommendation of `dirdotenv`/`direnv` and the note that `.envrc` should also be ignored. Since the question asks what to put in the setup to avoid accidental GitHub commits, the essential answer is present, so it is semantically equivalent enough."
"If I’m running a Python script, what’s the simple way to load variables from a .env file automatically?",8b2f5e9d04,good,"The AI answer correctly identifies `python-dotenv` and shows `load_dotenv()` to load a `.env` file in a Python script automatically. This matches the key point of the original answer’s Python-script equivalent. It omits the broader recommendation about dirdotenv/direnv and shell auto-loading, but that is not necessary for the specific question asked."
How do I decide the best field weights for minsearch without just guessing?,87d4ea4e08,good,"The AI answer conveys the same core guidance as the ground truth: use a ground-truth evaluation dataset, test different field weights, and compare retrieval metrics such as hit rate, precision@k, recall@k, and MRR. It also notes that trial and error is possible for small projects, matching the original meaning. The only omission is the explicit mention that the course covers this in the evaluation module, but that is not essential to the main answer."
"Is there a proper way to tune search field weights, or is it mostly trial and error?",87d4ea4e08,good,"The AI answer matches the ground truth closely: it recommends evaluating field weights against a ground-truth dataset, lists the same general steps and metrics, and notes that trial and error may be fine for small projects but systematic evaluation is more reliable. No key information is missing or incorrect."
What’s the best method to compare different field weights in a search engine?,87d4ea4e08,good,"The AI answer matches the ground truth closely: it recommends evaluating different field weights against a ground-truth dataset, outlines the same four-step process, mentions the same retrieval metrics, and notes that trial and error is acceptable for small projects but evaluation is more reliable. No key information is missing or incorrect."
Should I build a test set before changing field weights for retrieval?,87d4ea4e08,good,"The AI answer matches the ground truth: it recommends building a small ground-truth test set before changing field weights, outlines the same evaluation steps, mentions the same metrics, and notes that trial-and-error is possible but less reliable. No key information is missing or incorrect."
Which metrics should I use to see if my field weighting actually improves search results?,87d4ea4e08,good,"The AI answer matches the ground truth: it recommends evaluating field weights against a ground-truth set and lists the same retrieval metrics (hit rate, precision@k, recall@k, MRR). It also preserves the idea of using representative questions and known relevant documents. No key information is missing or incorrect."
What should I do to clean documents before using them for RAG?,649c280e6d,good,"The AI answer matches the ground truth closely. It includes the main cleaning steps: removing noise, preserving useful context, storing in a structured format, chunking with related context together, and keeping metadata. It also preserves the key point that the goal is improved retrieval accuracy, not just shorter text. Semantically equivalent."
"Is it a good idea to remove headers, footers, OCR mistakes, and other noisy text from my docs?",649c280e6d,good,"The AI answer matches the ground truth closely. It correctly says that removing noise like headers/footers, OCR mistakes, broken HTML, duplicate text, and boilerplate is generally a good idea, while preserving useful context such as titles, section names, dates, page numbers, speaker names, and Q&A structure. It also captures the main goal of improving retrieval accuracy rather than merely shortening text. It omits some details about structured storage, chunking, and metadata, but those are secondary and not required for semantic equivalence here."
"Do I need to keep things like titles, dates, section names, or speaker labels when preparing data for RAG?",649c280e6d,good,"The AI answer matches the ground truth on the key point: useful context such as titles, section names, dates, page numbers, speaker names, and Q&A structure should be preserved, while noise should be removed. It also correctly notes that metadata and structure help retrieval and ranking. It omits some extra details from the original (structured format/JSON, chunking), but those are not required for semantic equivalence to the specific question asked."
What format should I save my source documents in so they’re easier to chunk and search later?,649c280e6d,good,"The AI answer captures the core guidance: use a structured, easy-to-process format, JSON is often convenient but not required, and preserve useful metadata/context for chunking and retrieval. It omits some specifics like removing noise and examples of preserved context, but it remains semantically aligned with the original answer."
"How can I chunk documents for RAG without losing important context, and should I keep metadata too?",649c280e6d,good,"The AI answer captures all key points from the ground truth: clean noisy text, preserve useful context, use a structured format if convenient, chunk to keep related context together, and keep metadata for filtering/ranking. It also correctly emphasizes that the goal is improved retrieval accuracy, not just shorter chunks. This is semantically equivalent."
"Why does uv show ""Failed to hardlink files"" in GitHub Codespaces, and do I need to worry about it?",acf8fa5356,good,"The AI answer matches the ground truth: it explains that GitHub Codespaces can prevent hardlinking between uv's cache and the target environment, that installation still succeeds via copying, and it gives the same temporary and persistent suppression commands. The only omission is the uv docs link, which is not essential to the core answer."
"If uv can’t hardlink from the cache in Codespaces, will the install still work or does it break the package setup?",acf8fa5356,good,"The AI answer preserves the key point from the ground truth: installation still works, because uv falls back to copying files when hardlinking is not possible. It omits the warning suppression commands and documentation link, but those are extra details rather than core semantics."
How can I stop the uv hardlink warning for just my current terminal session?,acf8fa5356,good,"The AI answer correctly gives the command to suppress the warning for the current shell session and notes that it only affects the current session. It omits extra context about why the warning occurs and persistent configuration, but that is not required by the question."
What do I need to add to my shell config so uv always uses copy mode instead of trying to hardlink?,acf8fa5356,good,"The AI answer gives the exact environment variable needed and shows how to persist it in ~/.bashrc, matching the ground truth core answer. It omits some explanatory context about the warning and fallback behavior, but that is not necessary for correctness."
Is there an official place to read more about uv’s link mode and this hardlink/copy behavior?,acf8fa5356,good,"The AI answer captures the key point that the official documentation is the uv docs at https://docs.astral.sh/uv/. It does not mention the nuance that the original answer starts with ""No"" to the question of whether there is a special official place beyond the docs, but it still conveys that the docs are the place to read more. This is semantically close enough and not incorrect."
My code says `dotenv` is not recognized — what package do I need to install?,0bed1f48da,good,"The AI answer correctly identifies the needed package as `python-dotenv`, gives the same install command, and shows the correct import/use pattern. It preserves the core answer without contradiction or omission of key information."
How do I fix the `dotenv` import error in Python for the RAG module?,0bed1f48da,good,"The AI answer gives the same fix as the ground truth: install `python-dotenv` (via `uv add python-dotenv`) and import `load_dotenv` from `dotenv`, then call `load_dotenv()`. The extra troubleshooting and `pip install` alternative do not change the core answer."
What should I add with `uv` if `dotenv` isn’t available in my environment?,0bed1f48da,good,"The AI answer correctly identifies that `python-dotenv` should be added with `uv` and gives the exact command. It omits the follow-up import/use example and documentation link, but those are supplementary rather than essential to the question asked."
"After installing the dotenv package, how do I load the `.env` file in Python?",0bed1f48da,good,"The AI answer gives the correct code to load the .env file using `from dotenv import load_dotenv` and `load_dotenv()`, which matches the key point of the ground truth. It omits the installation command and documentation link, but those are extra details rather than essential to the question asked."
Is `python-dotenv` the right dependency when `dotenv` is missing?,0bed1f48da,good,"The AI answer matches the ground truth: it identifies python-dotenv as the correct dependency when dotenv is missing, gives the installation command, and shows the same import and load_dotenv usage. It adds pip install as an extra option, which does not change the core answer."
Can I do the course on my own laptop instead of using Codespaces?,aa310de435,good,"The AI answer preserves the core meaning: using a personal laptop is allowed, Codespaces is only the easiest shared environment, and local setup requires comfort with Python, uv, Jupyter, Docker, plus documenting/reproducibility. This is semantically equivalent to the ground truth."
"Is Codespaces required for the module, or can I set everything up locally?",aa310de435,good,"The AI answer preserves the key points from the ground truth: Codespaces is not required, local setup is possible with Python, uv, Jupyter, Docker, and other tools, and Codespaces is mainly for a consistent/easier shared environment. However, it omits the instruction to document the local setup and keep it reproducible. That said, the core answer is semantically equivalent."
What tools do I need if I want to run the course on my machine?,aa310de435,good,"The AI answer preserves the key requirements from the ground truth: running locally is possible, and it requires Python, uv, Jupyter, Docker, plus any other module-specific tools. It also correctly includes the advice to document the setup and keep it reproducible. Semantically equivalent."
