question,document,score,reasoning
"Can I just reduce the number of threads to avoid blowing through the quota, and what pool size should I use?",c1e9f4b820,good,"The AI answer captures the key point that lowering concurrency helps and gives the recommended pool size of 2–3 workers. It omits the additional context about per-minute vs per-day quotas and the other suggested alternatives, but those are not necessary to answer the specific question asked. Semantically it matches the relevant part of the ground truth."
"Is Groq a good free alternative here, and which model should I try for this task?",c1e9f4b820,bad,"The AI answer is not semantically equivalent to the ground truth. The ground truth specifically recommends Groq's free tier with `llama-3.3-70b-versatile`, and it frames the issue around Gemini's per-minute and per-day limits, plus lower concurrency and resuming progress. The AI instead suggests DeepSeek R1 or Llama 4, which are not the models named in the source, and omits the key recommendation to use `llama-3.3-70b-versatile`. It also adds irrelevant advice about OpenAI compatibility and tool schemas. Therefore it misses the key point about which Groq model to try."
"If the run gets cut off by quota, how do I continue without starting over from scratch?",c1e9f4b820,bad,"The AI answer does not address the question at all. The ground truth explains how to avoid restarting from scratch by saving progress periodically and resuming from partial output, along with other quota-handling options. Saying 'I don't know' misses the key point and is incorrect."
How do I fix the WinError 126 error when PyTorch can’t load fbgemm.dll on Windows?,15e931476c,good,"The AI answer conveys both key solutions from the ground truth: install the Visual C++ Redistributable, and if needed install Visual Studio (not VS Code). It also includes the reference link. This is semantically equivalent to the original answer."
Is installing the Visual C++ Redistributable enough to solve the missing fbgemm.dll module issue?,15e931476c,good,"The ground truth says there are two possible solutions: install Visual C++ Redistributable, and install Visual Studio (not VS Code). The AI answer correctly says the redistributable is only one solution and that Visual Studio may also be needed. This preserves the key point that the redistributable alone may not be enough."
"Do I need Visual Studio itself for the torch fbgemm.dll error, or is Visual Studio Code enough?",15e931476c,good,"The AI answer correctly distinguishes Visual Studio from Visual Studio Code and includes the key point that Visual Studio itself is needed, along with the Visual C++ Redistributable mention. This matches the ground truth closely."
"What should I install if I get ""The specified module could not be found"" for torch\lib\fbgemm.dll in Windows?",15e931476c,good,"The AI answer matches the ground truth: it recommends installing the Visual C++ Redistributable, and if needed Visual Studio rather than Visual Studio Code. This conveys the same key solutions without changing meaning."
"Why does PyTorch fail with OSError: [WinError 126] on Windows, and what’s the recommended fix?",15e931476c,good,"The AI answer matches the ground truth: it identifies the missing DLL/dependency issue behind WinError 126 and gives the same recommended fixes—install the Visual C++ Redistributable and, if needed, Visual Studio rather than Visual Studio Code. It preserves the key information accurately."
"Why do I get `psycopg2.OperationalError: could not translate host name ""postgres"" to address` when I run `python prep.py`?",4b65d5542d,good,The AI answer conveys the same fix as the ground truth: the host name 'postgres' cannot be resolved and `POSTGRES_HOST` should be changed to `localhost` in the `.env` file. No key information is missing.
What should I change in my `.env` file if the database host name `postgres` is not resolving?,4b65d5542d,good,The AI answer matches the ground truth: it instructs changing POSTGRES_HOST to localhost in the .env file and includes the correct example line. No key information is missing or incorrect.
How can I fix the host error in `prep.py` when Postgres works locally but the script still fails?,4b65d5542d,good,The AI answer conveys the same fix as the ground truth: update the .env file so POSTGRES_HOST is set to localhost. It also correctly explains the host name error context. Semantically equivalent.
Is there a setting I need to update so `POSTGRES_HOST` points to the right machine instead of `postgres`?,4b65d5542d,good,The AI answer conveys the same key fix as the ground truth: update the .env file so POSTGRES_HOST is set to localhost instead of postgres. The extra explanation about the error does not change the meaning.
What’s the quick fix for the `No such host is known` error in Module 5 monitoring?,4b65d5542d,good,The AI answer matches the ground truth: it identifies the fix as updating the .env file and setting POSTGRES_HOST to localhost. No key information is missing or incorrect.
How do I make Pandas stop cutting off long text in a column?,641aedbbf5,good,"The AI answer gives the exact Pandas option needed to prevent truncation of long text columns. It conveys the core fix correctly, matching the ground truth. Extra documentation details are omitted, but that is fine."
What’s the Pandas setting to show the full Explanation text in the offline-rag-evaluation notebook?,641aedbbf5,good,"The AI answer gives the exact Pandas setting needed to display the full text: `pd.set_option('display.max_colwidth', None)`. This matches the ground truth and correctly explains that it prevents truncation. No key information is missing."
"Why does Pandas only show part of a long string, and how can I see the whole thing?",641aedbbf5,good,"The AI answer correctly states that Pandas truncates long strings by default and provides the exact setting `pd.set_option('display.max_colwidth', None)` to display the full content. This matches the key information in the ground truth, though it omits some extra details like the default value and documentation notes, which are not essential."
How can I display the entire judge LLM explanation instead of the shortened version in a DataFrame?,641aedbbf5,good,"The AI answer gives the exact pandas setting needed to display full text instead of truncation and explains its effect correctly. It matches the ground truth key point, with no missing or incorrect information."
"Is there a way to change Pandas so a text column shows all characters, not just the first 50?",641aedbbf5,good,"The AI answer correctly states the Pandas option `pd.set_option('display.max_colwidth', None)` and explains that it removes the 50-character truncation so full text is displayed. This matches the ground truth key point."
How can I normalize vectors stored in a Pandas DataFrame column?,5039707c1a,good,The AI answer matches the ground truth exactly in meaning and code. It correctly shows applying a normalization lambda over the DataFrame column to create a new normalized column.
What’s a simple way to normalize each vector in a Pandas Series?,5039707c1a,good,"The AI answer matches the ground truth: it normalizes each vector by dividing by its L2 norm using a lambda with np.linalg.norm and applies it over the Pandas Series. The only difference is using a Series variable instead of a DataFrame column, which is semantically equivalent to the question asked."
Is there a quick Python lambda for normalizing vectors in a dataframe column?,5039707c1a,good,The AI answer matches the ground truth exactly in meaning and code: it provides a lambda using numpy.linalg.norm and applies it to a DataFrame column to create a normalized vector column. No key information is missing or incorrect.
How do I create a new column with normalized vectors from an existing one in Pandas?,5039707c1a,good,The AI answer matches the ground truth exactly in method and code: it defines a normalization lambda using NumPy norm and applies it to the existing column to create a new column. It also correctly explains the effect.
Can I use NumPy norm with apply() to normalize vectors in a DataFrame?,5039707c1a,good,"The AI answer conveys the same method as the ground truth: use apply() with a lambda that divides each vector by its NumPy norm, and shows essentially the same code. Extra offer to extend to other cases does not change correctness."
How do I calculate the 75th percentile for a column in a Pandas DataFrame?,b4c8ac5a0c,good,The AI answer exactly matches the ground truth method for computing the 75th percentile in a Pandas DataFrame column using quantile(q=0.75).
What’s the Pandas way to get the 0.75 quantile of a Series?,b4c8ac5a0c,good,"The AI answer correctly states the Pandas method for obtaining the 0.75 quantile of a Series using series.quantile(q=0.75). It also provides the DataFrame column equivalent, which matches the ground truth. Semantically equivalent and correct."
How can I find a column’s percentile value in pandas using quantile()?,b4c8ac5a0c,good,The AI answer matches the ground truth: it explains using `quantile()` with `q=0.75` for the 75th percentile and provides the same code. The extra examples are correct and do not change the meaning.
Is there a simple one-liner to compute the 75% quantile from df['col']?,b4c8ac5a0c,good,The AI answer gives the same one-liner as the ground truth for computing the 75% quantile using pandas Series.quantile(q=0.75). It is semantically equivalent and correct.
How do I extract a percentile from a dataframe column in pandas?,b4c8ac5a0c,good,"The AI answer matches the ground truth exactly in substance: it uses df[""col""].quantile(q=0.75) to compute the 75th percentile and states that it gives the 75th percentile. No key information is missing or incorrect."
"How do I delete every Docker container from the terminal, even the running ones?",66ccbb7da0,good,"The AI answer correctly gives the command to delete all Docker containers, including running ones. The original answer also includes optional commands to remove images and volumes, but the question specifically asks about deleting every Docker container, even running ones. The AI answer covers that key point accurately."
What’s the command to force-remove all Docker images at once?,66ccbb7da0,good,"The AI answer gives the correct command to force-remove all Docker images at once. The original answer also includes commands for containers and volumes, but the user asked specifically about images, so that is not missing key information for this question."
How can I wipe out all Docker volumes using the command line?,66ccbb7da0,good,"The AI answer gives the exact command for deleting all Docker volumes, which matches the key point of the original answer. Although the original also included steps to delete containers and images, the question specifically asks about wiping out all Docker volumes, so the AI answer is sufficient and correct."
Is there a quick way to clean up all containers and images in Docker from terminal?,66ccbb7da0,good,"The AI answer matches the ground truth: it provides the same commands to delete all containers, remove all images, and optionally delete all volumes. The extra 'I don't know.' is irrelevant and does not change the correctness of the main content."
"How do I fully reset Docker by removing containers, images, and volumes?",66ccbb7da0,good,"The AI answer gives the same three commands as the ground truth and correctly states that they remove all containers, images, and volumes. The extra phrase 'I don't know.' is irrelevant but does not change the correctness of the core answer."
How can I make feedback (+1 or -1) only possible once per submitted prompt in Streamlit?,2e729f1271,good,"The AI answer conveys the key idea: use Streamlit session state to track whether feedback was already given and prevent multiple +1/-1 clicks per submitted prompt. It also references the same solution link as the ground truth. Although it adds some implementation guidance, it is semantically aligned with the original answer."
Why does `st.session.submitted` keep flipping back to True even after I press a feedback button?,2e729f1271,good,"The AI answer conveys the same core point as the ground truth: the problem is caused by `st.session.submitted` being reassigned somewhere in the app logic, and it points to the same Streamlit Discuss solution. This is semantically equivalent."
"In my Streamlit app, how do I stop the feedback buttons from being usable after a user has already voted?",2e729f1271,good,"The AI answer conveys the same core solution as the ground truth: it points to using Streamlit session state / a flag to disable the feedback buttons after voting, and references the same discussion thread. It adds some speculative detail about `st.session.submitted`, but that does not contradict the main answer. The original answer is very terse, so this is semantically equivalent enough."
Is there a known fix for Streamlit session state getting reassigned when using ask and feedback buttons?,2e729f1271,good,"The AI answer conveys that the issue is solved and points to the same Streamlit Discuss solution link as the ground truth. This matches the core answer, with no incorrect information."
Where can I find the solution for the `st.session.submitted` issue with buttons disabling after submit?,2e729f1271,good,"The AI answer points to the same Streamlit Discuss solution link as the ground truth, conveying the required information without distortion."
"Why does my streamlit app fail in docker-compose with ""executable file not found in $PATH"", but works locally?",e8df9f0d12,good,"The AI answer conveys the same key points as the ground truth: the issue is that Streamlit is available locally but not properly set up in the container, and the suggested fix is to ensure a Dockerfile exists, add Streamlit to docker-compose configuration, and rebuild with `docker-compose up --build`. Extra explanatory text does not change the meaning."
What do I need to add so docker-compose can start a streamlit app without the OCI runtime error?,e8df9f0d12,good,"The AI answer matches the ground truth: it says to add streamlit to docker-compose, ensure a Dockerfile exists, and rebuild with docker-compose up --build. This conveys the same required steps to resolve the OCI runtime error."
Do I have to create a Dockerfile before running streamlit with docker-compose?,e8df9f0d12,good,"The AI answer matches the ground truth: it says a Dockerfile should be created, streamlit should be added to docker-compose, and the app should be rebuilt with `docker-compose up --build`. Extra offer of an example is fine."
"How can I fix the ""streamlit: executable file not found"" issue when launching the app through docker-compose?",e8df9f0d12,good,"The AI answer matches the ground truth: it says to create a Dockerfile, add streamlit to the docker-compose configuration, and run `docker-compose up --build`. The extra offer of help is harmless and does not change the meaning."
"After changing my docker-compose setup for streamlit, what command should I run to rebuild and start everything again?",e8df9f0d12,good,"The AI answer gives the exact command needed to rebuild and start the docker-compose setup again, matching the ground truth key point. It omits surrounding context, but that is not necessary for equivalence."
"Can we do the capstone as a group, or does each person need their own project?",0fab61eca2,good,"The AI answer preserves the key point that the capstone is individual, and correctly notes that collaboration on ideas is allowed while each submission must stand on its own. It also captures the requirement for independent evaluation and separate components/repository. This is semantically equivalent to the ground truth."
"If two students work on the same idea, how separate do the submissions have to be?",0fab61eca2,good,"The AI answer captures the main idea that students can work on similar topics if each submission is independently their own and meets requirements. However, it omits important specifics from the ground truth: the capstone is an individual project, shared systems must be decomposed into independent projects with separate qualifying components and separate repositories, and if work cannot be evaluated independently it fails the requirement. Still, the core answer is semantically aligned enough."
Is it okay to share a system with classmates as long as we split the parts up?,0fab61eca2,good,"The AI answer captures the key policy: shared systems are only acceptable if decomposed into independent projects with separate qualifying components and separate repositories, and each must be evaluable independently. However, it begins with ""Yes,"" which is misleading given the ground truth's emphasis that the capstone is an individual project and that a shared system is only conditionally acceptable under strict decomposition. Still, the substantive content matches the original answer closely enough overall."
Do we need a different repo for each person if we collaborate on one bigger project?,0fab61eca2,bad,"The AI answer captures the key requirement that each person's work must be independently evaluable and that a shared system must be decomposed into separate qualifying components with separate repositories. However, it incorrectly says 'Yes' to the question as if collaboration on one bigger project inherently means separate repos are required, whereas the ground truth emphasizes that the capstone is individual, collaboration is allowed, and a shared system can work only if decomposed appropriately. The answer is mostly aligned but slightly overstates the need for separate repositories in all collaborative cases, which could mislead."
What counts as an individual capstone if multiple people are involved in the same work?,0fab61eca2,good,"The AI answer preserves the core meaning of the ground truth: the capstone is individual, collaboration is allowed only if the shared work is decomposed into independent projects, each person needs a separate qualifying component and repository, and independent evaluation is required. This is semantically equivalent."
"Do we actually need to turn in two capstone projects, or is one enough?",d5fc98925d,good,"The AI answer correctly states that only one project is required and explains that Attempt 2 is for resubmission after an initial attempt, not necessarily a second distinct capstone. It also correctly mentions that two projects for practice must use different datasets and problem statements. However, it omits the note about missing the Attempt 1 window and the certification requirement tied to peer review. Those are extra details, not central to the asked question, so the answer is semantically equivalent."
"What does ""attempt 1"" and ""attempt 2"" mean for the project submission?",d5fc98925d,good,"The AI answer captures the key meaning correctly: attempt 1 and attempt 2 are two submission windows for the same project, you only need to submit one project, you can resubmit after a failed first attempt, and missing attempt 1 doesn't prevent attempting 2. It omits the extra note about submitting two different projects for experience and the certification/peer-review reminder, but those are ancillary to the asked question and not necessary for semantic equivalence."
"If my first submission doesn’t pass, can I fix it and send it again later?",d5fc98925d,good,"The AI answer correctly states that a failed first submission can be improved and resubmitted in the attempt #2 window. It captures the core point of the ground truth, though it omits extra details about only needing one project, the option to submit two projects with different datasets/problem statements, and the peer-review requirement. Those omissions do not change the answer to the asked question."
"Can I submit two projects just for practice, and if so do they have to be different?",d5fc98925d,good,"The AI answer correctly states that two practice projects must be different and specifies different datasets and problem statements. It also correctly notes that only one project is required. However, it omits some additional details from the ground truth about re-submission windows and peer-review, but those are not central to the direct question asked. The core answer is semantically equivalent."
"If I miss the first submission window, can I still submit in the second one and keep going?",d5fc98925d,good,"The AI answer correctly says that missing the first submission window does not prevent submitting in the second window and continuing. It captures the main point of the ground truth. It omits the extra details about only needing one project, re-submission after a failed first attempt, and the peer-review requirement, but those are not necessary for the core question asked."
"Can I use the competition itself as my capstone project, or are they separate things?",e892d44e42,good,"The AI answer matches the ground truth: it states that the competition does not count as the capstone, that they are separate, that the competition can be done in a group, and that the capstone is an individual project. The added detail about doing both is consistent and does not change the core meaning."
"If we join the math-kaggle-llm-competition in a team, does that still count toward the capstone?",e892d44e42,good,"The AI answer matches the ground truth: it clearly says team participation in the math-kaggle-llm-competition does not count toward the capstone, and that the capstone must be done individually. No key information is missing or contradicted."
Is the capstone supposed to be done solo even if the competition allows groups?,e892d44e42,good,"The ground truth says the capstone is an individual attempt and that competition participation can be as a group. The AI answer conveys this same meaning, though it phrases it as 'Yes' to the question and adds clarifying wording. Core information matches."
"Do I need to do an individual capstone, or can a team submission cover it?",e892d44e42,bad,"The ground truth says the capstone is an individual attempt, though the math-kaggle-llm-competition can be done in teams. The AI answer correctly states the capstone is individual, but then adds unsupported details about collaboration, separate repositories, and team submissions being acceptable if split into independent projects. That extra condition is not in the original answer and could mislead by implying a team submission might cover the capstone under some circumstances. The key point is preserved, but the added specifics change the meaning enough to be considered not semantically equivalent."
What’s the relationship between the math-kaggle-llm-competition and the capstone requirement?,e892d44e42,good,"The AI answer matches the ground truth: it says the competition does not count as the capstone, that the competition can be done in a group, and that the capstone is individual. This preserves the key relationship exactly."
"How exactly are capstone projects graded in the course, and who does the grading?",9a2e2d2008,good,"The AI answer matches the ground truth: it states that each project is evaluated by three randomly assigned students who also submitted the project, that each student must grade three peers' projects, and that the final grade is the median of the peer-review scores. It also includes the consequence of not completing peer reviews. This is semantically equivalent to the original answer."
"Will my project be reviewed by other students, and do I also need to review theirs?",9a2e2d2008,good,"The AI answer correctly states that the project will be reviewed by three randomly assigned students who also submitted the project, and that the student must also review three peers' projects. This matches the core information in the original answer. It omits the warning about certificate implications and the median score detail, but those are extra details not required for semantic equivalence here."
What happens if I don’t grade the three projects I’m supposed to review?,9a2e2d2008,good,"The AI answer captures the key consequence: not grading the three assigned projects may prevent you from earning the certificate. This matches the original answer's warning. It omits some surrounding details, but the core meaning is preserved."
How is the final capstone score calculated from the peer reviews?,9a2e2d2008,good,"The AI answer correctly states the key point: the final capstone score is the median of the three peer-review scores received. This matches the ground truth. It omits extra context about being assigned three reviewers and the obligation to grade others, but that is not necessary for answering the question asked."
Are there specific criteria or guidelines that reviewers have to follow when scoring the capstone project?,9a2e2d2008,good,"The AI answer captures the key points: projects are reviewed by three randomly assigned students, the final grade is the median of those scores, and reviewers must follow the course guidelines. It also correctly notes that the specific criteria are not provided in the context. This is semantically equivalent to the ground truth."
"After the project deadline, how are the review assignments given out?",eae0fb50aa,good,"The AI answer preserves the key information from the ground truth: after the submission deadline, an Excel sheet is shared and each participant gets 3 projects assigned. This is semantically equivalent."
Will we get a list or spreadsheet of the projects we need to grade?,eae0fb50aa,good,"The AI answer matches the ground truth: it confirms that after the submission deadline, an Excel sheet will be shared and that each participant will be assigned 3 projects to grade/review. This preserves the key information semantically."
