question,document,score,reasoning
"Why do I get a 402 from OpenRouter when I call responses.create, and how do I stop it?",cfb07a27d5,good,"The AI answer matches the ground truth on the core issue: OpenRouter may return 402 from responses.create when max_output_tokens is not set reasonably, and the fix is to pass a lower limit like 1024. It also correctly mentions the rag_helper.py and ToyAIKit variants, plus checking .env and credits. The only omissions are minor details such as the OpenAI 429 comparison and the suggestion to prefer a pinned model over openrouter/free, but those are not necessary for semantic equivalence."
Is there a way to set a smaller max_output_tokens value in responses.create so my free key doesn’t fail?,cfb07a27d5,good,"The AI answer correctly states that a smaller `max_output_tokens` can be set in `responses.create()`, gives the same example value, and mentions the same fixes for `rag_helper.py` and ToyAIKit. It preserves the key point that 1024 is sufficient for homework answers. It omits the extra troubleshooting/context about OpenRouter 402 behavior and endpoint/model checks, but that is additional detail rather than the core answer. Semantically, it matches the ground truth."
"In Module 1 homework, where should I add max_output_tokens=1024 in rag_helper.py?",cfb07a27d5,good,"The AI answer correctly identifies that max_output_tokens=1024 should be added inside the responses.create() call in the llm() method of rag_helper.py, matching the ground truth. It omits the broader OpenRouter explanation and other troubleshooting details, but those are not necessary to answer the question asked."
How do I pass max_output_tokens when using ToyAIKit’s OpenAIClient for Q6?,cfb07a27d5,good,"The AI answer gives the correct ToyAIKit/OpenAIClient usage for Q6: pass max_output_tokens inside extra_kwargs with the OpenAIClient constructor, matching the ground truth. It preserves the key point and the suggested token value. It omits broader troubleshooting context, but that is not necessary for semantic equivalence to the direct question."
"If I still see the 402 error, what should I check in my .env, model name, and OpenRouter key settings?",cfb07a27d5,good,"The AI answer correctly identifies the three checks in .env, model name, and OpenRouter key settings, matching the ground truth. It also includes the important extra fix of lowering max_output_tokens, which is consistent with the original answer. No key information is missing or incorrect."
"In the Module 1 homework, when people say point RAG at the chunk index, what does that actually mean?",b4300adeb1,good,"The AI answer matches the ground truth: it explains that 'point RAG at the chunk index' means building/searching the index over chunked documents rather than full original documents, gives the same example with `index.fit(chunks)` vs `index.fit(documents)`, and states that only retrieved chunks are added to the prompt to reduce context. Semantically equivalent."
Should I build the search index from the original documents or from the split chunks in the homework?,b4300adeb1,good,"The AI answer matches the ground truth: it clearly says to build the search index from the split chunks, not the original documents, and gives the correct example with index.fit(chunks) instead of documents. It preserves the key point and is semantically equivalent, even though it omits the extra explanation about RAG prompting context."
"If I have both `documents` and `chunks`, which one should I pass to `index.fit()`?",b4300adeb1,good,"The AI answer matches the ground truth: it correctly says to pass `chunks` to `index.fit()` rather than `documents`, and explains that the index should be built on chunked documents for retrieval of smaller relevant pieces. It omits some extra context about the RAG pipeline and prompt reduction, but that is not necessary for semantic equivalence."
Why does the homework want retrieval to use chunks instead of the full docs?,b4300adeb1,good,"The AI answer matches the ground truth: it explains that retrieval should be over chunks, not full documents, so only relevant chunks are inserted into the prompt and context is reduced. It preserves the key idea even without the explicit code example."
"Does RAG in this assignment send the whole document to the model, or only the matching chunks?",b4300adeb1,good,"The AI answer correctly states that RAG uses only the matching chunks, and that the index should be built/searched on chunks rather than full documents. This matches the ground truth semantics."
"For the module 1 homework, do the answers have to match the multiple-choice options exactly, or can I pick the nearest one if my number is a bit off?",5e4ca64cb5,good,"The AI answer preserves the key guidance: choose the closest option when the numeric answer is slightly off, and re-check if it is far from all options. This matches the ground truth semantically, with no incorrect information."
"If my calculated numeric result is close to one of the homework choices but not identical, should I still select that option?",5e4ca64cb5,good,"The AI answer conveys the core instruction from the ground truth: when a numeric result is close to one of the choices, pick the closest option. It omits the caveat that this is not always the case and the extra guidance about possible sources of discrepancy, but that does not change the main answer to the user’s question."
What should I do when my homework answer is slightly different from the listed options because of rounding or a different dataset version?,5e4ca64cb5,good,"The AI answer preserves the key guidance: if the computed numeric answer is close to an option, select the closest one; minor discrepancies can be due to rounding, dataset version, filtering, or provider differences; and if the result is far from all options, re-check instructions and dataset/version/code. This is semantically equivalent to the ground truth."
"Is it normal for homework outputs to vary a little due to filtering, floating-point math, or model/provider differences?",5e4ca64cb5,good,"The AI answer conveys the same core guidance as the ground truth: small differences can be normal due to filtering, dataset versions, floating-point/rounding, and model/provider behavior; choose the closest option if near one, and re-check if far from all. It omits the initial 'Not always' caveat and the reference link, but these are not essential to the semantic content."
"When my result is way off from all the answer choices, what things should I check first in the homework instructions?",5e4ca64cb5,good,"The AI answer captures the key guidance: if the result is far from all options, re-check the question wording, dataset version, and GitHub homework instructions. This matches the ground truth closely enough, and the extra suggestion to ask in Slack is acceptable. It omits some nuance about choosing the closest option when numeric answers are close, but that is not the core of the asked question."
"If the homework prompt is confusing, where should I check first?",7d3a2e3505,good,"The AI answer matches the core point of the ground truth: if the homework prompt is confusing, first read the GitHub homework instructions rather than only the course platform page. It omits the extra links and Slack guidance, but those are additional details, not the main answer to the question."
"For module 1, what links do I need to read before doing the assignment?",7d3a2e3505,good,"The AI answer includes the two required Module 1 links and the Slack guidance in essentially the same form. It omits the explicit reminder to read the GitHub homework instructions rather than only the course platform page, but the key links and instruction are preserved. This is semantically equivalent."
Why does the homework sometimes look different from the lesson walkthrough?,7d3a2e3505,good,"The AI answer captures the main explanation that homework follows the lesson workflow but may use a different dataset or slight variation, and it also correctly says to read the GitHub homework instructions first. However, it omits the specific links for Module 1 and the guidance to ask in Slack with text instead of screenshots. These are supporting details, not the core answer, so the semantic meaning is preserved."
What should I do if I still don't understand the task after reading the instructions?,7d3a2e3505,good,"The AI answer captures the main advice: read the GitHub homework instructions and, if still unclear, ask in Slack with text output rather than a screenshot. It omits the specific Module 1/2026 links and the note that homework usually follows the lesson workflow with a different dataset or a slight variation, but those are supportive details rather than the core answer to the question."
"When I ask for help in Slack, what kind of info should I paste instead of sending screenshots?",7d3a2e3505,good,"The AI answer captures the key point relevant to the question: when asking for help in Slack, paste the code or command output as text rather than a screenshot. It omits the extra context about reading the GitHub homework instructions first, but that is not needed to answer the specific question asked."
How can I check token usage for the Module 1 homework when I'm using another LLM provider?,fe8fed31e6,good,"The AI answer matches the ground truth: it says to get token count from the response object, inspect the provider’s usage fields, avoid using tiktoken/cl100k_base as a generic tokenizer, and use the provider’s native tokenizer if usage isn’t exposed. The only omission is the final instruction about multiple-choice homework questions choosing the closest option, but that does not affect the main token-usage guidance asked in the question."
Where should I look in the response to find the number of input tokens?,fe8fed31e6,good,"The AI answer captures the main point that input token count should be taken from the model/API response usage, specifically the OpenAI response. It omits the extra guidance about OpenAI-compatible fields like response.usage.input_tokens or response.usage.prompt_tokens and the note about other providers, but it does not contradict the ground truth. The core answer is semantically correct."
"Can I just use tiktoken or cl100k_base for Gemini, Mistral, Groq, or Hugging Face in this homework?",fe8fed31e6,good,"The AI answer matches the ground truth: it correctly says not to use tiktoken/cl100k_base for non-OpenAI providers, instructs to use token counts from the model response object (usage fields), and notes using the provider's native tokenizer if usage isn't exposed. It preserves the key guidance and omits only the minor multiple-choice note, which is not essential to the core answer."
What should I do if my provider doesn't give token usage in the response?,fe8fed31e6,good,"The AI answer captures the key guidance: if token usage is not exposed, use the provider’s native tokenizer as an approximation, and do not use tiktoken/cl100k_base generically for non-OpenAI providers. It omits some context about checking the response object first and the homework-specific note about multiple-choice questions, but the core answer is preserved."
"For the multiple-choice questions, what if my token count doesn't match any exact option?",fe8fed31e6,good,"The AI answer captures the key instruction for the multiple-choice case: if there is no exact match, select the closest option. It omits the surrounding guidance about how to obtain token counts and tokenizer caveats, but those are not necessary to answer this specific question. Semantically equivalent."
"Why is my homework repo link getting rejected with a 404 or 500, and what should I check first?",bcdb8740ce,good,"The AI answer matches the ground truth: it explains that the checker expects a publicly reachable URL returning HTTP 200, lists the same common causes (private repo, trailing .git, typo), and gives the same incognito/private-window test. It preserves the key first check and overall guidance."
Do I need to make the GitHub repository public for the submission checker to open it?,bcdb8740ce,good,"The AI answer states the key point that the repository must be public for the submission checker to access it, which matches the ground truth's main answer. It omits the additional troubleshooting details, but those are not necessary for semantic equivalence to the direct question."
"Should I submit the `.git` URL, or the normal repo link without it?",bcdb8740ce,good,"The AI answer correctly says to submit the normal repository URL without the `.git` suffix, which matches the key point of the ground truth. It omits the additional explanation about public access and URL accessibility, but the direct question is answered accurately."
What kind of URL mistake can cause the checker to see a non-200 response?,bcdb8740ce,good,"The AI answer correctly identifies one of the key URL mistakes from the ground truth: submitting a repository URL with a trailing .git instead of the plain repo URL. This matches the original answer's core point about a common cause of non-200 responses. Although it omits other causes like private repos or typos, it still answers the question asked about what kind of URL mistake can cause the checker to see a non-200 response."
How can I quickly test whether my repo URL is reachable by the grader?,bcdb8740ce,good,"The AI answer captures the key quick test from the ground truth: open the repo URL in a private/incognito window and if it loads, the grader should be able to reach it. It omits the extra troubleshooting details about 200 responses, private repos, and .git/typo issues, but those are not required for semantic equivalence to the quick-test question."
"What exactly are embeddings in vector search, and why do they turn text or other non-numeric data into numbers?",69430a79a8,good,"The AI answer matches the ground truth: it correctly explains embeddings as converting non-numeric data into numerical vectors while preserving meaning/context, and that similar inputs should map to nearby vectors so mathematical similarity search can be used. It also includes the core reason for turning text into numbers. Extra details about cosine similarity and vector search are consistent with the original and do not change the meaning."
How do embeddings keep the meaning and context of data when converting it into numerical form?,69430a79a8,good,"The AI answer matches the ground truth: it explains that embeddings convert non-numerical data into numerical vectors while preserving meaning/context by mapping similar inputs to nearby vectors, enabling mathematical semantic similarity. It omits the extra mentions of vector space model and dimensionality reduction, but those are not essential to the core answer."
Why should similar inputs produce similar vectors in an embedding model?,69430a79a8,good,"The AI answer captures the core idea: embeddings preserve meaning/context and similar inputs should map to nearby vectors so similarity measures can work. This is semantically equivalent to the ground truth, though it omits mentions of non-numerical data, vector space model, and dimensionality reduction, which are not essential to the direct answer."
How does the distance between embedding values help with semantic similarity search?,69430a79a8,good,"The AI answer preserves the core idea from the ground truth: embeddings convert meaning into numeric vectors, and proximity/distance between those vectors is used to assess semantic similarity. It correctly explains that closer embeddings imply more similar meaning and that search ranks documents by closeness. It also adds reasonable extra detail without contradicting the original answer."
"What’s the connection between embeddings, vector space models, and dimensionality reduction?",69430a79a8,good,The AI answer captures the core idea: embeddings convert non-numerical data into numerical vectors preserving meaning; vector space models are the framework of representing items as points where similar items are close; dimensionality reduction is related because embeddings often reduce high-dimensional data while preserving relationships. This is semantically aligned with the ground truth.
How can I get rid of the warning about multi-qa-mpnet-base-dot-v1 being made on sentence-transformers v3.0.0 beta?,aa3f597424,good,The AI answer matches the ground truth: it correctly says to upgrade sentence-transformers to 3.0.0 or higher and gives the same pip command. No key information is missing.
Is there a way to suppress the sentence-transformers warning when using multi-qa-mpnet-base-dot-v1?,aa3f597424,good,The AI answer matches the ground truth: it says to upgrade sentence-transformers to version 3.0.0 or higher and gives the same pip command. It also correctly states that this suppresses the warning for the specified model.
What do I need to install or upgrade to stop that model version warning from showing up?,aa3f597424,good,The AI answer matches the ground truth: it says to upgrade sentence-transformers to 3.0.0 or higher and provides the same pip command. No key information is missing.
"Why am I seeing the message that multi-qa-mpnet-base-dot-v1 was made on sentence-transformers v3.0.0 beta, and how do I disable it?",aa3f597424,good,"The AI answer conveys the same key point as the ground truth: the warning appears because the model was made with sentence-transformers v3.0.0 beta, and it can be suppressed by upgrading sentence-transformers to version 3.0.0 or higher with the same pip command. Extra context is harmless."
What’s the fix for the warning about sentence-transformers version compatibility with multi-qa-mpnet-base-dot-v1?,aa3f597424,good,The AI answer matches the ground truth: it says to upgrade sentence-transformers to 3.0.0 or higher and gives the same pip command. No key information is missing or incorrect.
Why did the lesson just use .dot(...) for similarity instead of explicitly doing cosine similarity?,92cd22cada,good,"The AI answer matches the ground truth: it explains that the lesson used dot product because the embeddings were assumed to be unit-normalized, making dot product equivalent to cosine similarity, and it notes that homework embeddings are not normalized by default so normalization is needed for equivalence. This preserves the key distinction and is semantically correct."
"Are the OpenAI embeddings already unit length, or do we need to normalize them first?",92cd22cada,good,"The AI answer matches the ground truth: it states that the OpenAI embeddings used in the lesson are assumed to already be unit length/normalized, making dot product equivalent to cosine similarity, and it correctly distinguishes this from TF-IDF + SVD embeddings in the homework, which are not normalized by default and therefore need manual normalization."
Why does the homework say to normalize vectors if the lesson seemed to skip that step?,92cd22cada,good,"The AI answer preserves the key explanation: the lesson assumed unit-normalized embeddings so dot product matched cosine similarity, while the homework uses TF-IDF + SVD embeddings that are not normalized by default and therefore need manual normalization. This is semantically equivalent to the ground truth."
"Is dot product the same as cosine similarity for every embedding model, or only some of them?",92cd22cada,good,"The AI answer matches the ground truth: it correctly states that dot product equals cosine similarity only for some embedding models, specifically when embeddings are unit-normalized, and notes that unnormalized embeddings like TF-IDF + SVD require manual normalization. It preserves the lesson/homework distinction and the key mathematical condition."
"For TF-IDF plus SVD embeddings, do I need to normalize before comparing vectors with dot product?",92cd22cada,good,The AI answer matches the ground truth: it states that TF-IDF + SVD embeddings are not normalized by default and that dot product only matches cosine similarity after manual normalization. It also correctly notes that lesson embeddings were unit-length already. Extra offer of code does not change correctness.
"For vector search, do I need to embed just the answer text, the question, or both together?",5c4a8d2e60,good,"The AI answer matches the ground truth closely. It correctly states there is no single right answer, that the choice should be tested on the dataset, lists the same three embedding options (answer only, question only, and question + answer/text), and notes that the combined form is often best but costs more. It also correctly mentions evaluating hit rate/MRR on a ground-truth set. Semantically equivalent."
"Which embedding setup usually works best: question only, text only, or question plus text?",5c4a8d2e60,good,"The AI answer captures the key idea that there is no single right answer and that the choice should be based on testing hit rate/MRR on the dataset. It also correctly states that question + text often works best. This matches the ground truth semantically, even though it omits the details about why each option works and the note about longer input/cost."
Why would embedding only the answer still work for matching user questions?,5c4a8d2e60,good,"The AI answer correctly explains that embedding only the answer can still work because the embedding model captures semantic similarity, allowing user questions with the same intent to be close in vector space. This matches the ground truth’s first bullet. It does omit the broader context that it’s one of several options and that the best choice should be determined empirically on the dataset, but the core explanation asked by the question is preserved."
Is there any downside to using question + text in the vector index?,5c4a8d2e60,good,"The AI answer matches the ground truth: it identifies the downside as longer input and slightly higher cost/less efficiency, notes that question+text is often the best option, and recommends testing on the dataset to choose based on hit rate/MRR. This preserves the key points and semantics."
How should I decide which embedding approach to use for my dataset?,5c4a8d2e60,bad,"The AI answer does not convey the ground-truth guidance at all. The correct answer says there is no single right answer and recommends testing three embedding approaches (text only, question only, or question + text) and choosing based on hit rate/MRR. Saying 'I don't know' misses the key information entirely."
How does cosine similarity measure how close two text vectors are?,db78580409,good,"The AI answer correctly explains that cosine similarity is based on the angle between vectors and gives the same range/interpretation of values as the ground truth. It also adds the equivalent dot-product interpretation for normalized vectors, which is accurate. No key information is missing or incorrect."
Why is cosine similarity commonly used in document or text comparison?,db78580409,good,"The AI answer correctly explains that cosine similarity compares document vectors by the angle between them, is used with word counts/TF-IDF/embeddings, and is useful because it focuses on content rather than document length. This matches the core rationale in the ground truth. It does not mention the full numeric range (-1 to 1), but that is not essential to the question."
"What does a cosine similarity score of 1, 0, or -1 actually mean?",db78580409,good,"The AI answer correctly maps cosine similarity values 1, 0, and -1 to identical direction, orthogonal/no similarity, and completely opposite vectors, which matches the ground truth. It omits some explanatory context but preserves the key meaning."
Can cosine similarity be used with word count or TF-IDF vectors?,db78580409,good,The AI answer directly addresses the question and matches the ground truth’s key point: cosine similarity is used with word count or TF-IDF vectors. It is concise but correct and semantically equivalent to the original answer’s core information.
What exactly is the angle between vectors telling us in cosine similarity?,db78580409,good,"The AI answer correctly explains that the angle indicates directional alignment and matches the key cosine similarity interpretations: small angle means high similarity, 90° means zero, and 180° means -1. It also correctly notes that cosine similarity measures direction, not length. This is semantically consistent with the ground truth, which states cosine similarity is the cosine of the angle between non-zero vectors and gives the same range and interpretations."
Why does cosine similarity turn into a simple dot product after normalization?,95feb4e75b,good,"The AI answer correctly explains that cosine similarity is the dot product divided by the product of vector norms, and that after normalizing vectors to unit length the denominator becomes 1, so cosine similarity reduces to the dot product. This matches the original answer’s core point about normalization removing magnitude effects and enabling efficient computation via dot products."
How come we can use matrix multiplication to compare one query with all document embeddings?,95feb4e75b,good,"The AI answer captures the key idea: normalized embeddings make cosine similarity equal to dot product, enabling efficient computation of query-to-all-document similarities via matrix multiplication. It is semantically equivalent to the ground truth."
"If vectors are already unit length, why do we not need to divide by their norms anymore?",95feb4e75b,good,"The AI answer correctly explains that unit-length vectors have norm 1, so dividing by the norm is unnecessary, and that cosine similarity then reduces to the dot product. This matches the ground truth’s key point that normalization makes magnitudes irrelevant and enables efficient dot-product computation. Minor wording differences do not affect correctness."
