question,document,score,reasoning
"I just found this course late — can I still join, or is it too late to start?",74eb249bbf,good,"The AI answer preserves the key meaning of the ground truth: late joining is allowed, and certificate eligibility depends on submitting the project while submissions are still being accepted. It is semantically equivalent."
Am I allowed to enroll if I only discovered the course now?,74eb249bbf,good,"The AI answer preserves the key points: late enrollment is allowed, and certificate eligibility requires submitting the project before submissions close. This is semantically equivalent to the ground truth."
"If I join after the course has started, can I still get a certificate?",74eb249bbf,good,"The AI answer preserves the original meaning: joining after the course has started does not prevent getting a certificate, provided the project is submitted while submissions are still being accepted. It is semantically equivalent."
What do I need to do to qualify for the certificate if I’m joining late?,74eb249bbf,bad,"The ground truth says that late joiners can still get a certificate only if they submit their project while submissions are still being accepted. The AI answer adds several unrelated requirements (live cohort, peer reviews, self-paced mode) and does not clearly state the key condition that the project must be submitted before the submission window closes. It therefore misses the main point and includes potentially incorrect extra constraints."
"Is it okay to start the course now, and what’s the deadline for the final project if I want the certificate?",74eb249bbf,bad,"The ground truth says it is okay to start now, but to get the certificate you must submit the project while submissions are still being accepted. The AI answer incorrectly adds requirements about finishing with a live cohort and passing a capstone project, and it fails to state the key deadline condition from the ground truth. It also says it does not know the specific deadline, which is not aligned with the provided answer. Therefore it is not semantically equivalent."
"I signed up for the LLM Zoomcamp — when should I get the confirmation email, or am I missing something?",977bf7786c,good,"The AI answer matches the ground truth: it says no confirmation email is needed, the user is already accepted, they can start learning and submit homework while the form is open, and registration is only to gauge interest. It preserves the key point that no registered list check is needed implicitly by saying they are accepted and can proceed."
Do I actually need a registration confirmation to join the course and submit homework?,977bf7786c,good,"The AI answer matches the ground truth: it says registration confirmation is not needed, the student is already accepted, and they can start learning and submitting homework while the form is open. It preserves the core point that registration is only for gauging interest, though it omits that last detail. That omission is not critical."
"If I never got an email after registering, can I still start the LLM Zoomcamp anyway?",977bf7786c,good,"The AI answer matches the ground truth: it says no confirmation email is needed, the user is accepted, registration is only to gauge interest, and they can start learning/submitting homework while the form is open even without registering. This conveys the same key information."
"Is there a real acceptance step for the course, or does registration just help you track interest?",977bf7786c,good,"The AI answer matches the ground truth: it says there is no real acceptance step, registration only gauges interest, and you can start learning and submitting homework without registering. The added mention of a confirmation email is extra but does not conflict with the original meaning."
"Do I need to be on some registered list before I can do the homework, or is that not required?",977bf7786c,good,"The AI answer matches the ground truth: it clearly states registration is not required, you can start learning and submitting homework while the form is open, and there is no registered-list check. It omits the detail that registration is just to gauge interest before the start date, but that does not change the core meaning."
How do students join the Office Hours or live workshop stream if the Zoom link is private?,489dd1c9d9,good,"The AI answer matches the ground truth: it correctly states that students do not use the private Zoom link, that they watch via YouTube Live, ask questions via Slido with the link pinned in chat, and that the stream URL is posted in Telegram/Slack announcements before the session. It also includes the warning not to post questions in chat. Semantically equivalent."
Where can I find the live video link for office hours before the session starts?,489dd1c9d9,good,"The AI answer correctly states where the live video URL is posted before the session starts: the announcements channel on Telegram and Slack, and that it can also be watched on the DataTalksClub YouTube channel. It omits some extra details from the ground truth (Zoom link only for instructors, Slido, and not using chat), but those are not required to answer the question."
"If I can’t use Zoom, what should I use to watch the workshop and ask questions?",489dd1c9d9,good,"The AI answer matches the ground truth: students watch via YouTube Live, ask questions via Slido, and the stream link is posted in Telegram/Slack announcements and on the DataTalksClub YouTube channel. It omits the warning not to post questions in chat, but that is extra detail rather than a core requirement."
"Why aren’t students given the Zoom URL for office hours, and where should questions go instead?",489dd1c9d9,good,"The AI answer correctly states that the Zoom URL is only for instructors/presenters/TAs and that students should use YouTube Live and Slido for questions. It also mentions Slack as a place to ask outside the live session, which is not contradictory. The core answer matches the ground truth, though it omits Telegram and the warning not to post questions in chat, but those omissions do not change the main meaning."
"Is the live session posted anywhere like Telegram, Slack, or YouTube before it begins?",489dd1c9d9,good,"The AI answer correctly states that the video URL is posted in the announcements channel on Telegram and Slack before the session begins, and that it can also be watched live on the DataTalksClub YouTube channel. This matches the core of the ground truth. It omits the extra details about Zoom links being restricted to instructors/presenters/TAs and about Slido/questions in chat, but those are not required for the question asked."
What’s the best way to begin the course if I’m new here and don’t want to miss anything?,04919992b3,good,"The AI answer preserves the key guidance: start with the docs and GitHub repo, you can begin anytime, and the typical workflow of videos -> notebooks/code -> homework instructions -> submission matches the ground truth. It adds Codespaces, which is extra but not contradictory. It omits the explicit note that homework is similar to the lesson flow but with a different dataset or slightly different task, but that is a minor detail and not essential to the main answer."
"Do I need to wait for a start date, or can I just jump into the LLM Zoomcamp materials whenever I want?",04919992b3,good,"The AI answer correctly states that there is no need to wait for a start date and that the materials are already available. It also mentions submitting homework while the form is open, which is consistent with the original. However, it omits some supporting details from the ground truth, such as the specific docs/repository references and the typical workflow/deadline platform. These omissions do not change the core meaning."
"What’s the usual weekly routine for this course — video first, then notebooks, then homework?",04919992b3,good,"The AI answer matches the ground truth’s main workflow exactly: videos, notebooks/code, homework instructions, and submission before deadline. It also correctly states that homework is similar but uses a different dataset or slightly different task. It omits the initial resource links and the note that you can start whenever you want, but those are extra details, not essential to the asked weekly routine."
Where are the deadlines and homework instructions posted for the course?,04919992b3,good,"The AI answer correctly identifies the two key places: deadlines on the course management platform and homework instructions in the GitHub repo. This matches the ground truth's core information, even though it omits extra context and linked resources."
"Is the homework basically the same as the lesson exercises, or does it use different data/tasks?",04919992b3,good,The AI answer matches the key point from the ground truth: homework is similar to the lesson flow but uses a different dataset or slightly different task. It preserves the semantic meaning without omitting the core answer to the user's question.
How do I find myself on the leaderboard if I can’t see my name there?,c2903069a0,good,"The AI answer correctly states that users are assigned a random name and should click the “Jump to your record on the leaderboard” link to find their entry. It also correctly mentions “Edit Course Profile” for viewing or changing the display name. It omits the extra details about the two profile fields and certificate name, but those are not required to answer the question."
Why does the leaderboard show some random name instead of my real one?,c2903069a0,bad,"The AI answer captures the key point that the leaderboard uses a random default display name and that it can be changed in Edit Course Profile. However, it misses an important detail from the ground truth: the instruction to click 'Jump to your record on the leaderboard' to find your entry, and more importantly that the second field in Edit Course Profile is the official/legal name required for the certificate. It also simplifies the certificate-name distinction in a way that may be okay, but the ground truth specifically says the official name must be entered to avoid the random name appearing on the certificate. Since the core explanation is mostly present, this is close, but the omission of the certificate-related requirement makes it incomplete."
Where can I check what display name I’m using for the course?,c2903069a0,good,"The AI answer correctly identifies that the user can check their display name by clicking “Edit Course Profile,” and that the first field is the nickname/display name. It omits some additional context about the random assigned name and the certificate/official name, but those are not required for the question asked."
Can I change the name that appears on the leaderboard and in the course profile?,c2903069a0,good,"The AI answer correctly states that the leaderboard/display name can be changed in Edit Course Profile and that the second field is the official certificate name. This matches the key point of the ground truth. It omits some extra specifics (automatic random name, exact navigation), but those are not necessary for semantic equivalence."
How do I make sure the name on my certificate is my official name and not the default one?,c2903069a0,good,"The AI answer preserves the key point: use Edit Course Profile and set the second field to your official/legal name, while the first field is just the displayed nickname. It also correctly states that the certificate uses the second field. This is semantically equivalent to the ground truth."
Can I do the course on my own schedule and still get the certificate?,69d122f12e,good,"The AI answer matches the ground truth: it states that certificates are only available with a live cohort, not self-paced, and correctly explains the peer-review requirement during the course run. No key information is missing or incorrect."
"If I take the self-paced version, will I still receive a certificate at the end?",69d122f12e,good,"The AI answer conveys the key point correctly: no certificate for self-paced mode, only for finishing with a live cohort. It omits the explanation about peer-review timing, but that is extra detail not required for semantic equivalence."
Do certificates count for students who join later and study without the live cohort?,69d122f12e,bad,The AI answer does not answer the question and fails to convey the ground truth that certificates are not awarded for self-paced/later-joining students; only live cohort participants who complete the peer-review requirement can receive one.
Why isn’t there a certificate for self-paced learners in this course?,69d122f12e,good,"The AI answer matches the ground truth: it states that certificates are only for live cohort participants, not self-paced learners, and explains the peer-review requirement and timing constraint as the reason. No key information is missing or incorrect."
Is the certificate only available when the course is running live and peer review is open?,69d122f12e,good,"The AI answer captures the main idea that certificates are only available in the live cohort and that peer review is tied to the course running/open review period. It does not mention the self-paced mode explicitly, but that omission does not change the core meaning. However, it says 'Yes' to the question phrased as if availability depends on live/peer review; the ground truth states the certificate is only for the live cohort and not self-paced. The semantic content is essentially equivalent."
Can I still get the course certificate if I skipped the first homework?,9f689c185f,good,"The AI answer matches the ground truth: it states that homework is not mandatory, skipping the first homework does not prevent certification, and passing the Capstone project is required. It also correctly notes that homework affects leaderboard rank and is recommended for learning."
"Is the first homework required for the certificate, or is the final project enough?",9f689c185f,good,"The AI answer matches the ground truth: it states that homework is not required for the certificate, and that passing the Capstone project is necessary. It also preserves the recommendation that homework is optional but useful. The only omission is the leaderboard point detail, which is extra and not essential to the question."
Do I need to complete all homework assignments to receive the certificate?,9f689c185f,good,"The AI answer matches the ground truth: it states homework is not required for the certificate, and that passing the Capstone project is necessary. It also correctly mentions homework is recommended and affects leaderboard rank."
"If homework isn't mandatory, what do I need to pass to get certified?",9f689c185f,good,"The AI answer conveys the key point from the ground truth: certification requires passing the Capstone project, and homework is not mandatory. It omits the extra detail about homework being recommended and counting toward leaderboard rank, but that is not necessary for semantic equivalence."
Does missing homework stop me from earning the certificate in this course?,9f689c185f,good,"The AI answer matches the ground truth: homework is not required for the certificate, and passing the Capstone project is required. It also correctly mentions that homework is recommended. The extra detail about missing the first homework does not change the meaning."
Why does the homework content keep changing before it’s released?,96286b4be4,good,"The AI answer preserves the key points: '[DRAFT]' means not ready, homework is only ready when the form is open and the title no longer has '[DRAFT]', content may still change before then, and doing it early is at your own risk. This is semantically equivalent to the ground truth."
What does it mean when a homework title has [DRAFT] in it?,96286b4be4,good,"The AI answer correctly states the key point that a `[DRAFT]` homework title means the homework is not ready yet. It omits additional details about when homework is considered ready and the warning that content may still change, but those are supporting details rather than the core answer."
How can I tell if a homework assignment is actually ready?,96286b4be4,good,"The AI answer matches the ground truth: it states the two conditions required for readiness and correctly notes that if either condition is unmet, the homework is not ready and may still change. It omits the explicit statement that working in advance is at the student's own risk, but that is extra detail rather than a core requirement."
Can I start working on a homework before the final version is out?,96286b4be4,good,"The AI answer matches the ground truth: it explains that a draft title means the homework is not ready, states the two conditions for readiness, and warns that starting early is at the student's own risk because content may change. This is semantically equivalent."
Why is the homework on the platform still different from what I saw earlier?,96286b4be4,good,"The AI answer matches the ground truth: it explains that `[DRAFT]` means the homework is not ready, lists the same two conditions for readiness, and notes that the content can still change until then. Semantically equivalent."
When is llm-zoomcamp going to be offered again?,bd31146b0e,good,The AI answer exactly matches the ground truth and conveys the same information: llm-zoomcamp will be offered again in Summer 2027.
Do we know the next start date for this course?,bd31146b0e,good,"The AI answer matches the ground truth exactly in meaning, stating the next start date is Summer 2027. It preserves the key information with no contradiction or omission."
Is there a planned offering of the course in Summer 2027?,bd31146b0e,good,The AI answer directly matches the ground truth by confirming the course is planned for Summer 2027. It preserves the key information without contradiction or omission.
When should I expect the next run of llm-zoomcamp?,bd31146b0e,bad,"The AI answer does not match the ground truth. The correct answer is 'Summer 2027,' while the AI explicitly says it does not know the next run date and adds unrelated information about acceptance and homework. It misses the key point and is incorrect."
What’s the next time this course will be available?,bd31146b0e,good,The AI answer exactly matches the ground truth and conveys the same information: the course will next be available in Summer 2027.
Where should I start if I want to find the course videos and lesson materials?,31456f4b5f,good,"The AI answer correctly identifies the LLM Zoomcamp GitHub repository as the main starting point, notes that lesson folders/pages contain the video links at the top, and explains that the repo is preferable to the YouTube playlist because it is more up to date. The extra mention of other docs does not contradict the ground truth."
"Do I need to check YouTube for the lectures, or is there a better place to look first?",31456f4b5f,good,"The AI answer matches the ground truth: it says to use the LLM Zoomcamp GitHub repository as the first place to look, notes that each lesson folder links the relevant videos, and explains that the repo is easier to keep updated than YouTube. This preserves the key guidance and intent."
How do I find the videos for each lesson in the LLM Zoomcamp course?,31456f4b5f,good,"The AI answer conveys the same key guidance as the original: use the LLM Zoomcamp GitHub repository, open the lesson folders, find videos linked at the top of each lesson page, and prefer the repo over the YouTube playlist because it is more up to date. This is semantically equivalent."
Is there an official repo page that points to the lecture videos for every lesson?,31456f4b5f,good,"The AI answer matches the ground truth: it identifies the LLM Zoomcamp GitHub repository as the official main entry point and says each lesson page links the relevant lecture videos at the top. It preserves the core guidance and omits only the extra note about preferring GitHub over the YouTube playlist, which is not essential to the question."
"If the YouTube playlist is out of date, where should I go to get the most current lesson links?",31456f4b5f,good,"The AI answer correctly states that the LLM Zoomcamp GitHub repository is the main entry point and should be used instead of the YouTube playlist for the most up-to-date lesson links. This matches the ground truth key point, even though it omits the detail about opening lesson folders and finding videos at the top of each lesson page."
"Where do I follow the LLM Zoomcamp syllabus, homework deadlines, and my progress in one place?",20c5a1347e,good,"The AI answer matches the ground truth: it points to the LLM Zoomcamp course management platform and correctly states that it contains the syllabus, homework, deadlines, and progress tracking in one place. The extra formatting does not change the meaning."
Is there a course dashboard for checking the current cohort structure and upcoming assignments in LLM Zoomcamp?,20c5a1347e,good,"The AI answer matches the ground truth: it confirms the course management platform, provides the same link, and includes the key features (current cohort structure, homework, deadlines, progress tracking)."
How can I keep track of deadlines and homework for the LLM Zoomcamp course?,20c5a1347e,good,"The AI answer conveys the key point: use the LLM Zoomcamp course management platform to track deadlines, homework, and progress, and it includes the correct URL. The extra mention of docs and GitHub repo does not contradict the ground truth. Semantically equivalent."
What platform should I use to monitor my progress during the LLM Zoomcamp?,20c5a1347e,good,"The AI answer matches the ground truth: it recommends the LLM Zoomcamp course management platform with the correct link and notes that it contains course structure, homework, deadlines, and progress tracking. The mention of other DataTalks.Club Zoomcamps is omitted, but that is not essential to the answer."
"Does LLM Zoomcamp have a management site for syllabus updates, homework, and cohort info?",20c5a1347e,good,"The AI answer matches the ground truth: it confirms there is a course management platform and includes the same link, along with the relevant items (cohort structure/info, homework, deadlines, progress tracking). It is semantically equivalent."
"Do we get live classes or office hours for every module, or is the course mostly pre-recorded?",d65e05bd7a,good,"The AI answer matches the ground truth: it states the course is mostly pre-recorded, there are no default live sessions/office hours for every module, live sessions are announced separately, Slack is used for help with question guidelines, and AI Shipping Labs is an optional paid add-on with regular Zoom office hours. Minor wording differences do not change the meaning."
Where should I ask for help if I’m stuck on a module?,d65e05bd7a,good,"The AI answer correctly identifies Slack as the place to ask for help and mentions following the asking questions guidelines. It adds an extra tip about sharing text instead of screenshots, which is not contradictory. However, it omits the context that there are no separate live sessions by default and the optional AI Shipping Labs support, but those are not necessary to answer the direct question."
"How do I know when a live session is happening, since it doesn’t seem to be every week?",d65e05bd7a,good,"The AI answer captures the main point that live sessions are not scheduled for every module and are announced separately. It also correctly advises asking questions in Slack and following the asking-questions guidelines. However, it adds specific channels like Telegram, video URL posting, and YouTube that are not mentioned in the ground truth, and it omits the optional extra support via AI Shipping Labs. Since the core answer is still correct and the extra details do not contradict the original, this is semantically equivalent enough."
"Is there any paid option that gives more support, like regular Zoom office hours?",d65e05bd7a,good,"The AI answer captures the key point from the ground truth: there is an optional paid community (AI Shipping Labs) that provides regular Zoom office hours and additional structured support, while the course content remains free. It omits some extra details about module materials being pre-recorded and Slack guidance, but those are not required to answer the question."
Are the course materials available somewhere in the repo even without live sessions?,d65e05bd7a,good,"The AI answer correctly says the module materials are pre-recorded and available in the course repo even without live sessions, which matches the core of the ground truth. It adds a repository link and says each lesson folder contains materials and video links; this extra detail is not contradicted by the ground truth. It omits the note that live sessions are announced separately, Slack is used for questions, and AI Shipping Labs is optional extra support, but those are supplementary rather than the main point asked in the question."
Can I count my Bluesky posts toward learning in public credits?,dbf5369006,good,The AI answer matches the ground truth exactly in meaning: it confirms that Bluesky posts count toward learning in public credits. No key information is missing or incorrect.
Is Bluesky accepted for the learning in public requirement?,dbf5369006,good,The AI answer matches the ground truth exactly in meaning and wording. It correctly states that Bluesky posts can be used for learning in public credits.
Do posts on Bluesky qualify for course credits if I'm learning in public?,dbf5369006,good,The AI answer exactly matches the ground truth and conveys the same key information: Bluesky posts qualify for learning in public course credits.
